CREATE Database NETFLIX_DATABASE_India;
USE NETFLIX_DATABASE_India;
CREATE TABLE customer(
   Customer_Id  INTEGER  NOT NULL PRIMARY KEY 
  ,First_Name   VARCHAR(15) NOT NULL
  ,Last_Name    VARCHAR(15) NOT NULL
  ,Email_ID     VARCHAR(32) NOT NULL
  ,Password     VARCHAR(30) NOT NULL
  ,Phone_Number VARCHAR(20) NOT NULL
  ,State        VARCHAR(19) NOT NULL
  ,Country      VARCHAR(13) NOT NULL
  ,Sign_up_date DATE
);


CREATE TABLE Invoice(
   Invoice_number INTEGER  NOT NULL PRIMARY KEY 
  ,Customer_id    INTEGER  NOT NULL 
  ,Sign_up_date   VARCHAR(13) NOT NULL
  ,Plan           VARCHAR(8) NOT NULL
  ,Service_period VARCHAR(25) NOT NULL
  ,Payment_method VARCHAR(15) NOT NULL
  ,Total          VARCHAR(30) NOT NULL
);

CREATE TABLE streams (
	Stream_id INT NOT NULL PRIMARY KEY,
	Customer_id INT, 
	Content_id INT,
	Stream_date DATE,
	Stream_time VARCHAR(20),
	Stream_duration INT,
	Stream_rating INT
);

CREATE TABLE content(
   content_id      INTEGER  NOT NULL PRIMARY KEY 
  ,title           VARCHAR(40) NOT NULL
  ,episode         INTEGER  NOT NULL
  ,genre           VARCHAR(29) NOT NULL
  ,duration        INTEGER  NOT NULL
  ,cost_per_stream VARCHAR(10) NOT NULL
  ,release_date    DATE NOT NULL
  ,Production_companies VARCHAR(60) NOT NULL
);



INSERT INTO customer(Customer_Id,First_Name,Last_Name,Email_ID,Password,Phone_Number,State,Country,Sign_up_date) VALUES (1,'rahul','Kumar','rahul@gmail.com','password','+91-855-533-6738','Andhra Pradesh','India','2010-08-07');
INSERT INTO customer(Customer_Id,First_Name,Last_Name,Email_ID,Password,Phone_Number,State,Country,Sign_up_date) VALUES (2,'priya','Sharma','priya@gmail.com','12345','+91-965-551-0974','Arunachal Pradesh','India','2009-03-11');
INSERT INTO customer(Customer_Id,First_Name,Last_Name,Email_ID,Password,Phone_Number,State,Country,Sign_up_date) VALUES (3,'Tanya','Lal','tanya@gmail.com','123456','+91-855-519-3598','Assam','India','2014-02-07');
INSERT INTO customer(Customer_Id,First_Name,Last_Name,Email_ID,Password,Phone_Number,State,Country,Sign_up_date) VALUES (4,'Abhishek','Shan','shan@gmail.com','123456789','+91-935-559-1754','Bihar','India ','2017-11-05');
INSERT INTO customer(Customer_Id,First_Name,Last_Name,Email_ID,Password,Phone_Number,State,Country,Sign_up_date) VALUES (5,'Priyanka','Jai','jai@gmail.com','12345678','+91-905-550-9158','Chhattisgarh','India ','2007-06-25');
INSERT INTO customer(Customer_Id,First_Name,Last_Name,Email_ID,Password,Phone_Number,State,Country,Sign_up_date) VALUES (6,'divya','Pal','divya@gmail.com','india123','+91-935-556-3227','Goa','India ','2017-08-05');
INSERT INTO customer(Customer_Id,First_Name,Last_Name,Email_ID,Password,Phone_Number,State,Country,Sign_up_date) VALUES (7,'Aditya','Aggarwal','aditya@gmail.com','1234567890','+91-755-512-4638"','Gujarat','India','2019-07-15');
INSERT INTO customer(Customer_Id,First_Name,Last_Name,Email_ID,Password,Phone_Number,State,Country,Sign_up_date) VALUES (8,'Amit','Raje','Raje@gmail.com','1234567','+91-755-586-7888','Haryana','India','2019-06-26');
INSERT INTO customer(Customer_Id,First_Name,Last_Name,Email_ID,Password,Phone_Number,State,Country,Sign_up_date) VALUES (9,'mahesh','Chande','Chande@gmail.com','qwerty','+91-965-556-9150','Himachal Pradesh','India','2000-12-19');
INSERT INTO customer(Customer_Id,First_Name,Last_Name,Email_ID,Password,Phone_Number,State,Country,Sign_up_date) VALUES (10,'tanvi','Chander','Chander@gmail.com','abc123','+91-755-567-7284','Jharkhand','India','2006-11-07');
INSERT INTO customer(Customer_Id,First_Name,Last_Name,Email_ID,Password,Phone_Number,State,Country,Sign_up_date) VALUES (11,'mahesh','Nara','nara@gmail.com','xxx','+91-855-519-2452','Karnataka','India','2005-04-08');
INSERT INTO customer(Customer_Id,First_Name,Last_Name,Email_ID,Password,Phone_Number,State,Country,Sign_up_date) VALUES (12,'ROHIT','ROHIT','ROHIT@gmail.com','iloveyou','+91-755-565-7448','Kerala','India','1999-10-19');
INSERT INTO customer(Customer_Id,First_Name,Last_Name,Email_ID,Password,Phone_Number,State,Country,Sign_up_date) VALUES (13,'vani','Nath','Nath@gmail.com','krishna','+91-855-573-3536','Madhya Pradesh','India','2014-04-23');
INSERT INTO customer(Customer_Id,First_Name,Last_Name,Email_ID,Password,Phone_Number,State,Country,Sign_up_date) VALUES (14,'Anjali','Goel','Goel@gmail.com','Indya123','+91-755-582-1506','Maharashtra','India','2016-04-29');
INSERT INTO customer(Customer_Id,First_Name,Last_Name,Email_ID,Password,Phone_Number,State,Country,Sign_up_date) VALUES (15,'Ankit','Bhat','Bhat@gmail.com','1qaz@WSX','+91-855-569-9097','Manipur','India','2013-08-18');
INSERT INTO customer(Customer_Id,First_Name,Last_Name,Email_ID,Password,Phone_Number,State,Country,Sign_up_date) VALUES (16,'yash','Raji','Raji@gmail.com','123123','+91-855-513-3678','Meghalaya','India','2010-08-31');
INSERT INTO customer(Customer_Id,First_Name,Last_Name,Email_ID,Password,Phone_Number,State,Country,Sign_up_date) VALUES (17,'Shreya','Anand','Anand@gmail.com','sairam','+91-915-554-8903','Mizoram','India','2011-05-25');
INSERT INTO customer(Customer_Id,First_Name,Last_Name,Email_ID,Password,Phone_Number,State,Country,Sign_up_date) VALUES (18,'shyam','Suri','Suri@gmail.com','omsairam','+91-955-558-8931','Nagaland','India','2014-02-02');
INSERT INTO customer(Customer_Id,First_Name,Last_Name,Email_ID,Password,Phone_Number,State,Country,Sign_up_date) VALUES (19,'riya','Kapoor','Kapoor@gmail.com','abcd1234','+91-755-550-7048','Punjab','India','2016-07-16');
INSERT INTO customer(Customer_Id,First_Name,Last_Name,Email_ID,Password,Phone_Number,State,Country,Sign_up_date) VALUES (20,'Deepak','Chandra','Chandra@gmail.com','1qaz','+91-755-526-6456','Odisha','India','2005-05-10');
INSERT INTO customer(Customer_Id,First_Name,Last_Name,Email_ID,Password,Phone_Number,State,Country,Sign_up_date) VALUES (21,'Aryan','Patel ','Patel@gmail.com','1234','+91-995-557-0490','Rajasthan','India','2019-09-15');
INSERT INTO customer(Customer_Id,First_Name,Last_Name,Email_ID,Password,Phone_Number,State,Country,Sign_up_date) VALUES (22,'Sneha','Verma','Verma@gmail.com','jaimatadi','+91-945-554-0744','Sikkim','India','1999-01-19');
INSERT INTO customer(Customer_Id,First_Name,Last_Name,Email_ID,Password,Phone_Number,State,Country,Sign_up_date) VALUES (23,'Aishwarya','Malhotra','Malhotra@gmail.com','password1','+91-995-557-6759','Tamil Nadu','India','2011-10-13');
INSERT INTO customer(Customer_Id,First_Name,Last_Name,Email_ID,Password,Phone_Number,State,Country,Sign_up_date) VALUES (24,'Raj','Sai','Sai@gmail.com','welcome','+91-945-557-5472','Telangana','India','2015-12-31');
INSERT INTO customer(Customer_Id,First_Name,Last_Name,Email_ID,Password,Phone_Number,State,Country,Sign_up_date) VALUES (25,'Arjun','Engineer','Engineer@gmail.com','indian','+91-755-539-5280','Tripura','India','2013-03-17');
INSERT INTO customer(Customer_Id,First_Name,Last_Name,Email_ID,Password,Phone_Number,State,Country,Sign_up_date) VALUES (26,'Gayatri','Arun','Gayatri@gmail.com','gayatriii','+91-755-537-0467','Uttar Pradesh','India','2017-08-24');
INSERT INTO customer(Customer_Id,First_Name,Last_Name,Email_ID,Password,Phone_Number,State,Country,Sign_up_date) VALUES (27,'varsha','Madan','Madan@gmail.com','saibaba','+91-925-553-0083','Uttarakhand','India','2011-01-23');
INSERT INTO customer(Customer_Id,First_Name,Last_Name,Email_ID,Password,Phone_Number,State,Country,Sign_up_date) VALUES (28,'Manoj','Prasad','Prasad@gmail.com','654321','+91-755-579-8253','West Bengal','India','2012-02-13');
INSERT INTO customer(Customer_Id,First_Name,Last_Name,Email_ID,Password,Phone_Number,State,Country,Sign_up_date) VALUES (29,'Ira','Srini','Srini@gmail.com','welcome123','+91-855-576-6463','Andhra Pradesh','India','2018-06-01');
INSERT INTO customer(Customer_Id,First_Name,Last_Name,Email_ID,Password,Phone_Number,State,Country,Sign_up_date) VALUES (30,'ankur','Sara','Sara@gmail.com','linkedin','+91-985-551-0009','Arunachal Pradesh','India','2005-05-08');
INSERT INTO customer(Customer_Id,First_Name,Last_Name,Email_ID,Password,Phone_Number,State,Country,Sign_up_date) VALUES (31,'akash','Rana','Rana@gmail.com','bigbasket','+91-755-537-2884','Assam','India','2016-08-01');
INSERT INTO customer(Customer_Id,First_Name,Last_Name,Email_ID,Password,Phone_Number,State,Country,Sign_up_date) VALUES (32,'sanjana','Raman','Raman@gmail.com','ganesh','+91-935-556-4736','Bihar','India','2000-09-05');
INSERT INTO customer(Customer_Id,First_Name,Last_Name,Email_ID,Password,Phone_Number,State,Country,Sign_up_date) VALUES (33,'Niharika','Subram','Subram@gmail.com','sachin','+91-755-594-0422','Chhattisgarh','India','1999-06-19');
INSERT INTO customer(Customer_Id,First_Name,Last_Name,Email_ID,Password,Phone_Number,State,Country,Sign_up_date) VALUES (34,'Karan','Mehta','Mehta@gmail.com','computer','+91-855-572-0678','Goa','India','2001-06-07');
INSERT INTO customer(Customer_Id,First_Name,Last_Name,Email_ID,Password,Phone_Number,State,Country,Sign_up_date) VALUES (35,'rakesh','Subramani','Subramani@gmail.com','ghost','+91-855-515-2132','Gujarat','India','2011-06-30');
INSERT INTO customer(Customer_Id,First_Name,Last_Name,Email_ID,Password,Phone_Number,State,Country,Sign_up_date) VALUES (36,'Nikita','Sethi','Sethi@gmail.com','123','+91-855-581-0869','Haryana','India','2017-09-21');
INSERT INTO customer(Customer_Id,First_Name,Last_Name,Email_ID,Password,Phone_Number,State,Country,Sign_up_date) VALUES (37,'Sam','Vijaya','Vijaya@gmail.com','qwerty123','+91-755-502-9199','Himachal Pradesh','India','2002-09-26');
INSERT INTO customer(Customer_Id,First_Name,Last_Name,Email_ID,Password,Phone_Number,State,Country,Sign_up_date) VALUES (38,'natasha','Malik','Malik@gmail.com','qwertyuiop','+91-755-569-9946','Jharkhand','India','2005-09-11');
INSERT INTO customer(Customer_Id,First_Name,Last_Name,Email_ID,Password,Phone_Number,State,Country,Sign_up_date) VALUES (39,'Neha','Narayan','Narayan@gmail.com','111111','+91-755-590-8484','Karnataka','India','2006-06-04');
INSERT INTO customer(Customer_Id,First_Name,Last_Name,Email_ID,Password,Phone_Number,State,Country,Sign_up_date) VALUES (40,'Naveen','Mittal','Mittal@gmail.com','passw0rd','+91-855-502-5337','Kerala','India','2014-11-13');
INSERT INTO customer(Customer_Id,First_Name,Last_Name,Email_ID,Password,Phone_Number,State,Country,Sign_up_date) VALUES (41,'Ashish','Nita','Nita@gmail.com','abhishek','+91-965-551-4534','Madhya Pradesh','India','2018-12-27');
INSERT INTO customer(Customer_Id,First_Name,Last_Name,Email_ID,Password,Phone_Number,State,Country,Sign_up_date) VALUES (42,'shivangi','Kishore','Kishore@gmail.com','987654321','+91-755-598-0502','Maharashtra','India','2016-03-18');
INSERT INTO customer(Customer_Id,First_Name,Last_Name,Email_ID,Password,Phone_Number,State,Country,Sign_up_date) VALUES (43,'ramya','Roy','Roy@gmail.com','priyanka','+91-975-551-9866','Manipur','India','2004-01-16');
INSERT INTO customer(Customer_Id,First_Name,Last_Name,Email_ID,Password,Phone_Number,State,Country,Sign_up_date) VALUES (44,'Vinay','Chaudhary','Chaudhary@gmail.com','dragon','+91-855-541-7776','Meghalaya','India','2001-06-27');
INSERT INTO customer(Customer_Id,First_Name,Last_Name,Email_ID,Password,Phone_Number,State,Country,Sign_up_date) VALUES (45,'Parth','Charan','Charan@gmail.com','asdfghjkl','+91-975-558-6507','Mizoram','India','2005-09-08');
INSERT INTO customer(Customer_Id,First_Name,Last_Name,Email_ID,Password,Phone_Number,State,Country,Sign_up_date) VALUES (46,'Isha','Nigam','Nigam@gmail.com','zomato','+91-755-596-8959','Nagaland','India','2009-03-21');
INSERT INTO customer(Customer_Id,First_Name,Last_Name,Email_ID,Password,Phone_Number,State,Country,Sign_up_date) VALUES (47,'ananya','Sen','ananya@gmail.com','monkey','+91-855-563-9575','Odisha','India','2003-02-22');
INSERT INTO customer(Customer_Id,First_Name,Last_Name,Email_ID,Password,Phone_Number,State,Country,Sign_up_date) VALUES (48,'Mayank','Subramanian','Subramanian@gmail.com','tinkle','+91-855-556-6744','Punjab','India','2018-06-27');
INSERT INTO customer(Customer_Id,First_Name,Last_Name,Email_ID,Password,Phone_Number,State,Country,Sign_up_date) VALUES (49,'vivek','Nirmal','Nirmal@gmail.com','rajesh','+91-755-535-8105','Rajasthan','India','2019-07-22');
INSERT INTO customer(Customer_Id,First_Name,Last_Name,Email_ID,Password,Phone_Number,State,Country,Sign_up_date) VALUES (50,'shivani','Pawan','Pawan@gmail.com','deepak','+91-755-501-4494','Sikkim','India','2019-06-23');
INSERT INTO customer(Customer_Id,First_Name,Last_Name,Email_ID,Password,Phone_Number,State,Country,Sign_up_date) VALUES (51,'vivek','Manohar','Manohar@gmail.com','dubsmash','+91-925-555-7139','Tamil Nadu','India','2007-12-12');
INSERT INTO customer(Customer_Id,First_Name,Last_Name,Email_ID,Password,Phone_Number,State,Country,Sign_up_date) VALUES (52,'Aaditya','Sahni','Sahni@gmail.com','lakshmi','+91-855-509-8832','Telangana','India','2012-06-14');
INSERT INTO customer(Customer_Id,First_Name,Last_Name,Email_ID,Password,Phone_Number,State,Country,Sign_up_date) VALUES (53,'Sakshi','Lalit','Lalit@gmail.com','aditya','+91-995-555-2699','Tripura','India','2016-12-06');
INSERT INTO customer(Customer_Id,First_Name,Last_Name,Email_ID,Password,Phone_Number,State,Country,Sign_up_date) VALUES (54,'Aaditya','Rajan','Rajan@gmail.com','target123','+91-905-556-5232','Uttar Pradesh','India','2001-11-23');
INSERT INTO customer(Customer_Id,First_Name,Last_Name,Email_ID,Password,Phone_Number,State,Country,Sign_up_date) VALUES (55,'Neeraj','Sehgal','Sehgal@gmail.com','abcdef','+91-955-552-0011','Uttarakhand','India','2000-02-15');
INSERT INTO customer(Customer_Id,First_Name,Last_Name,Email_ID,Password,Phone_Number,State,Country,Sign_up_date) VALUES (56,'Aswini','Uddin','Uddin@gmail.com','hanuman','+91-755-510-2348','West Bengal','India','2009-08-11');
INSERT INTO customer(Customer_Id,First_Name,Last_Name,Email_ID,Password,Phone_Number,State,Country,Sign_up_date) VALUES (57,'Neeraj','Saini','Saini@gmail.com','sanjay','+91-985-552-9636','Andhra Pradesh','India','2019-05-05');
INSERT INTO customer(Customer_Id,First_Name,Last_Name,Email_ID,Password,Phone_Number,State,Country,Sign_up_date) VALUES (58,'kumar','Neel','Neel@gmail.com','mother','+91-945-557-6025','Arunachal Pradesh','India','2013-09-21');
INSERT INTO customer(Customer_Id,First_Name,Last_Name,Email_ID,Password,Phone_Number,State,Country,Sign_up_date) VALUES (59,'Suhani','Jana','Jana@gmail.com','sandeep','+91-855-588-5933','Assam','India','2004-07-26');
INSERT INTO customer(Customer_Id,First_Name,Last_Name,Email_ID,Password,Phone_Number,State,Country,Sign_up_date) VALUES (60,'leah','Darsha','Darsha@gmail.com','password123','+91-915-555-3455','Bihar','India','2007-09-22');
INSERT INTO customer(Customer_Id,First_Name,Last_Name,Email_ID,Password,Phone_Number,State,Country,Sign_up_date) VALUES (61,'Abhinav','Ranga','Ranga@gmail.com','zxcvbnm','+91-955-553-2482','Chhattisgarh','India','2011-08-06');
INSERT INTO customer(Customer_Id,First_Name,Last_Name,Email_ID,Password,Phone_Number,State,Country,Sign_up_date) VALUES (62,'Soham','Vish','Vish@gmail.com','sweety','+91-955-550-4248','Goa','India','2010-07-12');
INSERT INTO customer(Customer_Id,First_Name,Last_Name,Email_ID,Password,Phone_Number,State,Country,Sign_up_date) VALUES (63,'Pavithra','Mehra','Mehra@gmail.com','wowecarts@123','+91-915-554-4771','Gujarat','India','2002-04-20');
INSERT INTO customer(Customer_Id,First_Name,Last_Name,Email_ID,Password,Phone_Number,State,Country,Sign_up_date) VALUES (64,'seema','Puri','Puri@gmail.com','1g2w3e4r','+91-855-518-5865','Haryana','India','2016-08-08');
INSERT INTO customer(Customer_Id,First_Name,Last_Name,Email_ID,Password,Phone_Number,State,Country,Sign_up_date) VALUES (65,'Pranav','Muthu','Muthu@gmail.com','samsung','+91-955-558-3908','Himachal Pradesh','India','2012-07-29');
INSERT INTO customer(Customer_Id,First_Name,Last_Name,Email_ID,Password,Phone_Number,State,Country,Sign_up_date) VALUES (66,'Anusha','Gandhi','Gandhi@gmail.com','zag12wsx','+91-755-568-9372','Jharkhand','India','2009-08-28');
INSERT INTO customer(Customer_Id,First_Name,Last_Name,Email_ID,Password,Phone_Number,State,Country,Sign_up_date) VALUES (67,'Rohan','Lata','Lata@gmail.com','gwerty123','+91-755-539-2272','Karnataka','India','1999-11-21');
INSERT INTO customer(Customer_Id,First_Name,Last_Name,Email_ID,Password,Phone_Number,State,Country,Sign_up_date) VALUES (68,'ajith','Chauhan','Chauhan@gmail.com','gwerty','+91-855-532-7865','Madhya Pradesh','India','2013-09-01');
INSERT INTO customer(Customer_Id,First_Name,Last_Name,Email_ID,Password,Phone_Number,State,Country,Sign_up_date) VALUES (69,'Suraj','Menon','menon@gmail.com','iloveu','+91-855-546-7285','Kerala','India','2013-10-31');
INSERT INTO customer(Customer_Id,First_Name,Last_Name,Email_ID,Password,Phone_Number,State,Country,Sign_up_date) VALUES (70,'simran','Saxena','Saxena@gmail.com','asdfgh','+91-975-557-9545','Maharashtra','India','2019-05-03');
INSERT INTO customer(Customer_Id,First_Name,Last_Name,Email_ID,Password,Phone_Number,State,Country,Sign_up_date) VALUES (71,'nishi','Swami','Swami@gmail.com','friends','+91-755-597-4905','Manipur','India','2004-05-06');
INSERT INTO customer(Customer_Id,First_Name,Last_Name,Email_ID,Password,Phone_Number,State,Country,Sign_up_date) VALUES (72,'ABHI','Neela','ABHI@gmail.com','ashish','+91-855-556-0342','Meghalaya','India','2012-01-27');
INSERT INTO customer(Customer_Id,First_Name,Last_Name,Email_ID,Password,Phone_Number,State,Country,Sign_up_date) VALUES (73,'PRATEEK','Chandrasekar','Chandrasekar@gmail.com','qwe123','+91-855-560-3594','Mizoram','India','2009-08-29');
INSERT INTO customer(Customer_Id,First_Name,Last_Name,Email_ID,Password,Phone_Number,State,Country,Sign_up_date) VALUES (74,'Anushri','Soni','Soni@gmail.com','P@ssw0rd','+91-855-536-9755','Nagaland','India','2001-04-09');
INSERT INTO customer(Customer_Id,First_Name,Last_Name,Email_ID,Password,Phone_Number,State,Country,Sign_up_date) VALUES (75,'Ayushi','Dhawan','Dhawan@gmail.com','waheguru','+91-755-554-4620','Odisha','India','2015-02-27');
INSERT INTO customer(Customer_Id,First_Name,Last_Name,Email_ID,Password,Phone_Number,State,Country,Sign_up_date) VALUES (76,'Raghav','Nagpal','Nagpal@gmail.com','manish','+91-915-556-6358','Punjab','India','2004-08-21');
INSERT INTO customer(Customer_Id,First_Name,Last_Name,Email_ID,Password,Phone_Number,State,Country,Sign_up_date) VALUES (77,'Radhika','Joshi','Joshi@gmail.com','hariom','+91-755-527-6568','Rajasthan','India','2016-08-11');
INSERT INTO customer(Customer_Id,First_Name,Last_Name,Email_ID,Password,Phone_Number,State,Country,Sign_up_date) VALUES (78,'Rishabh','Krishnamurthy','Krishnamurthy@gmail.com','anjali','+91-755-545-3739','Tamil Nadu','India','2002-10-05');
INSERT INTO customer(Customer_Id,First_Name,Last_Name,Email_ID,Password,Phone_Number,State,Country,Sign_up_date) VALUES (79,'tanu','Persaud','Persaud@gmail.com','mumbai','+91-855-573-3359','Sikkim','India','2013-12-01');
INSERT INTO customer(Customer_Id,First_Name,Last_Name,Email_ID,Password,Phone_Number,State,Country,Sign_up_date) VALUES (80,'krithika','Punj','Punj@gmail.com','suresh','+91-755-509-1458','Telangana','India','2000-02-18');
INSERT INTO customer(Customer_Id,First_Name,Last_Name,Email_ID,Password,Phone_Number,State,Country,Sign_up_date) VALUES (81,'Vaibhav','Veena','Veena@gmail.com','bangalore','+91-755-557-7536','Tripura','India','2008-11-21');
INSERT INTO customer(Customer_Id,First_Name,Last_Name,Email_ID,Password,Phone_Number,State,Country,Sign_up_date) VALUES (82,'Kunal','Mahajan','Mahajan@gmail.com','india','+91-755-575-2105','Uttar Pradesh','India','2015-05-04');
INSERT INTO customer(Customer_Id,First_Name,Last_Name,Email_ID,Password,Phone_Number,State,Country,Sign_up_date) VALUES (83,'Akansha','Manju','Manju@gmail.com','prakash','+91-755-528-4541','Uttarakhand','India','2004-07-04');
INSERT INTO customer(Customer_Id,First_Name,Last_Name,Email_ID,Password,Phone_Number,State,Country,Sign_up_date) VALUES (84,'Sadaf','Dutta','Dutta@gmail.com','vishal','+91-975-553-1725','West Bengal','India','2002-08-13');
INSERT INTO customer(Customer_Id,First_Name,Last_Name,Email_ID,Password,Phone_Number,State,Country,Sign_up_date) VALUES (85,'vikas','Sandeep','Sandeep@gmail.com','khushi','+91-755-501-0225','Andhra Pradesh','India','2006-06-10');
INSERT INTO customer(Customer_Id,First_Name,Last_Name,Email_ID,Password,Phone_Number,State,Country,Sign_up_date) VALUES (86,'Raju','Narang','Narang@gmail.com','santosh','+91-755-527-3856','Arunachal Pradesh','India','2011-10-31');
INSERT INTO customer(Customer_Id,First_Name,Last_Name,Email_ID,Password,Phone_Number,State,Country,Sign_up_date) VALUES (87,'sanjay','Naran','Naran@gmail.com','hello123','+91-755-502-0439','Assam','India','2005-12-29');
INSERT INTO customer(Customer_Id,First_Name,Last_Name,Email_ID,Password,Phone_Number,State,Country,Sign_up_date) VALUES (88,'diya','Veer','Veer@gmail.com','balaji','+91-755-594-2635','Bihar','India','2013-01-26');
INSERT INTO customer(Customer_Id,First_Name,Last_Name,Email_ID,Password,Phone_Number,State,Country,Sign_up_date) VALUES (89,'Nishita','Tyagi','Tyagi@gmail.com','poonam','+91-855-572-0019','Chhattisgarh','India','2000-05-18');
INSERT INTO customer(Customer_Id,First_Name,Last_Name,Email_ID,Password,Phone_Number,State,Country,Sign_up_date) VALUES (90,'Siya','Samuel','Samuel@gmail.com','harsha','+91-935-553-3952','Goa','India','2001-11-08');
INSERT INTO customer(Customer_Id,First_Name,Last_Name,Email_ID,Password,Phone_Number,State,Country,Sign_up_date) VALUES (91,'Abigail','Srivastava','Srivastava@gmail.com','manisha','+91-755-509-8278','Gujarat','India','2012-10-29');
INSERT INTO customer(Customer_Id,First_Name,Last_Name,Email_ID,Password,Phone_Number,State,Country,Sign_up_date) VALUES (92,'shivam','Sudha','Sudha@gmail.com','sharma','+91-755-552-0638','Haryana','India','2014-06-05');
INSERT INTO customer(Customer_Id,First_Name,Last_Name,Email_ID,Password,Phone_Number,State,Country,Sign_up_date) VALUES (93,'Kalyani','Srivas','Srivas@gmail.com','666666','+91-855-597-8535','Himachal Pradesh','India','2005-01-24');
INSERT INTO customer(Customer_Id,First_Name,Last_Name,Email_ID,Password,Phone_Number,State,Country,Sign_up_date) VALUES (94,'Nishant','Mati','Mati@gmail.com','gaurav','+91-755-526-9442','Jharkhand','India','2006-02-22');
INSERT INTO customer(Customer_Id,First_Name,Last_Name,Email_ID,Password,Phone_Number,State,Country,Sign_up_date) VALUES (95,'Nitin','Neelam','Neelam@gmail.com','asdf1234','+91-755-508-1293','Karnataka','India','1999-09-12');
INSERT INTO customer(Customer_Id,First_Name,Last_Name,Email_ID,Password,Phone_Number,State,Country,Sign_up_date) VALUES (96,'Krishna','Rastogi','Rastogi@gmail.com','lovely','+91-995-555-4125','Madhya Pradesh','India','2001-11-05');
INSERT INTO customer(Customer_Id,First_Name,Last_Name,Email_ID,Password,Phone_Number,State,Country,Sign_up_date) VALUES (97,'Constantine','Chakrabarti ','Constantine@gmail.com','creative','+91-755-514-6690','Kerala','India','2009-02-06');
INSERT INTO customer(Customer_Id,First_Name,Last_Name,Email_ID,Password,Phone_Number,State,Country,Sign_up_date) VALUES (98,'sara','Bhatt','Bhatt@gmail.com','engineer','+91-755-512-5183','Maharashtra','India','1999-10-08');
INSERT INTO customer(Customer_Id,First_Name,Last_Name,Email_ID,Password,Phone_Number,State,Country,Sign_up_date) VALUES (99,'indhumathi','Srivastav','Srivastav@gmail.com','success','+91-855-521-6341','Madhya Pradesh','India','2015-04-11');
INSERT INTO customer(Customer_Id,First_Name,Last_Name,Email_ID,Password,Phone_Number,State,Country,Sign_up_date) VALUES (100,'Ram','Ganesh','Ganesh@gmail.com','prashant','+91-915-556-3264','Punjab','India','2017-01-10');



INSERT INTO Invoice(Invoice_number,Customer_id,Sign_up_date,Plan,Service_period,Payment_method,Total) VALUES (20495,1,'8/7/10','Premium','2010-08-07 to 2010-09-06','MasterCard','Rs.649');
INSERT INTO Invoice(Invoice_number,Customer_id,Sign_up_date,Plan,Service_period,Payment_method,Total) VALUES (34686 ,2,'3/11/09','Standard','2009-03-11 to 2009-04-10','Visa','Rs.499');
INSERT INTO Invoice(Invoice_number,Customer_id,Sign_up_date,Plan,Service_period,Payment_method,Total) VALUES (67666 ,3,'2/7/14','Basic','2014-02-07 to 2014-03-09','Discover','Rs.199');
INSERT INTO Invoice(Invoice_number,Customer_id,Sign_up_date,Plan,Service_period,Payment_method,Total) VALUES (94946,4,'11/5/17','Premium','2017-11-05 to 2017-12-05','MasterCard','Rs.649');
INSERT INTO Invoice(Invoice_number,Customer_id,Sign_up_date,Plan,Service_period,Payment_method,Total) VALUES (69524 ,5,'6/25/07','Basic','2007-06-25 to 2007-07-25','Discover','Rs.199');
INSERT INTO Invoice(Invoice_number,Customer_id,Sign_up_date,Plan,Service_period,Payment_method,Total) VALUES (42681,6,'8/5/17','Basic','2017-08-05 to 2017-09-04','Visa','Rs.499');
INSERT INTO Invoice(Invoice_number,Customer_id,Sign_up_date,Plan,Service_period,Payment_method,Total) VALUES (41960 ,7,'7/15/19','Premium','2019-07-15 to 2019-08-14','MasterCard','Rs.649');
INSERT INTO Invoice(Invoice_number,Customer_id,Sign_up_date,Plan,Service_period,Payment_method,Total) VALUES (24143,8,'6/26/19','Basic','2019-06-26 to 2019-07-26','Discover','Rs.199');
INSERT INTO Invoice(Invoice_number,Customer_id,Sign_up_date,Plan,Service_period,Payment_method,Total) VALUES (46159 ,9,'12/19/00','Standard','2000-12-19 to 2001-01-18','AmericanExpress','Rs.499');
INSERT INTO Invoice(Invoice_number,Customer_id,Sign_up_date,Plan,Service_period,Payment_method,Total) VALUES (13171,10,'11/7/06','Premium','2006-11-07 to 2006-12-07','MasterCard','Rs.649');
INSERT INTO Invoice(Invoice_number,Customer_id,Sign_up_date,Plan,Service_period,Payment_method,Total) VALUES (34428 ,11,'4/8/05','Standard','2005-04-08 to 2005-05-08','MasterCard','Rs.199');
INSERT INTO Invoice(Invoice_number,Customer_id,Sign_up_date,Plan,Service_period,Payment_method,Total) VALUES (70108 ,12,'10/19/99','Standard','1999-10-19 to 1999-11-18','MasterCard','Rs.199');
INSERT INTO Invoice(Invoice_number,Customer_id,Sign_up_date,Plan,Service_period,Payment_method,Total) VALUES (69993,13,'4/23/14','Premium','2014-04-23 to 2014-05-23','Visa','Rs.649');
INSERT INTO Invoice(Invoice_number,Customer_id,Sign_up_date,Plan,Service_period,Payment_method,Total) VALUES (43305 ,14,'4/29/16','Premium','2016-04-29 to 2016-05-29','Visa','Rs.499');
INSERT INTO Invoice(Invoice_number,Customer_id,Sign_up_date,Plan,Service_period,Payment_method,Total) VALUES (23217,15,'8/18/13','Basic','2013-08-18 to 2013-09-17','MasterCard','Rs.199');
INSERT INTO Invoice(Invoice_number,Customer_id,Sign_up_date,Plan,Service_period,Payment_method,Total) VALUES (27690 ,16,'8/31/10','Basic','2010-08-31 to 2010-09-30','Discover','Rs.649');
INSERT INTO Invoice(Invoice_number,Customer_id,Sign_up_date,Plan,Service_period,Payment_method,Total) VALUES (50398 ,17,'5/25/11','Basic','2011-05-25 to 2011-06-24','Visa','Rs.199');
INSERT INTO Invoice(Invoice_number,Customer_id,Sign_up_date,Plan,Service_period,Payment_method,Total) VALUES (67645 ,18,'2/2/14','Basic','2014-02-02 to 2014-03-04','Discover','Rs.649');
INSERT INTO Invoice(Invoice_number,Customer_id,Sign_up_date,Plan,Service_period,Payment_method,Total) VALUES (78544 ,19,'7/16/16','Premium','2016-07-16 to 2016-08-15','Visa','Rs.499');
INSERT INTO Invoice(Invoice_number,Customer_id,Sign_up_date,Plan,Service_period,Payment_method,Total) VALUES (01674 ,20,'5/10/05','Standard','2005-05-10 to 2005-06-09','Visa','Rs.199');
INSERT INTO Invoice(Invoice_number,Customer_id,Sign_up_date,Plan,Service_period,Payment_method,Total) VALUES (33549 ,21,'9/15/19','Standard','2019-09-15 to 2019-10-15','Discover','Rs.649');
INSERT INTO Invoice(Invoice_number,Customer_id,Sign_up_date,Plan,Service_period,Payment_method,Total) VALUES (27883 ,22,'1/19/99','Premium','1999-01-19 to 1999-02-18','Discover','Rs.649');
INSERT INTO Invoice(Invoice_number,Customer_id,Sign_up_date,Plan,Service_period,Payment_method,Total) VALUES (93751 ,23,'10/13/11','Basic','2011-10-13 to 2011-11-12','AmericanExpress','Rs.499');
INSERT INTO Invoice(Invoice_number,Customer_id,Sign_up_date,Plan,Service_period,Payment_method,Total) VALUES (93286,24,'12/31/15','Basic','2015-12-31 to 2016-01-30','Discover','Rs.199');
INSERT INTO Invoice(Invoice_number,Customer_id,Sign_up_date,Plan,Service_period,Payment_method,Total) VALUES (72017 ,25,'3/17/13','Basic','2013-03-17 to 2013-04-16','Visa','Rs.199');
INSERT INTO Invoice(Invoice_number,Customer_id,Sign_up_date,Plan,Service_period,Payment_method,Total) VALUES (97563 ,26,'8/24/17','Standard','2017-08-24 to 2017-09-23','MasterCard','Rs.499');
INSERT INTO Invoice(Invoice_number,Customer_id,Sign_up_date,Plan,Service_period,Payment_method,Total) VALUES (54462 ,27,'1/23/11','Basic','2011-01-23 to 2011-02-22','Discover','Rs.199');
INSERT INTO Invoice(Invoice_number,Customer_id,Sign_up_date,Plan,Service_period,Payment_method,Total) VALUES (26899 ,28,'2/3/12','Basic','2012-02-03 to 2012-03-04','Visa','Rs.199');
INSERT INTO Invoice(Invoice_number,Customer_id,Sign_up_date,Plan,Service_period,Payment_method,Total) VALUES (48937 ,29,'6/1/18','Standard','2018-06-01 to 2018-07-01','Discover','Rs.499');
INSERT INTO Invoice(Invoice_number,Customer_id,Sign_up_date,Plan,Service_period,Payment_method,Total) VALUES (58526 ,30,'5/21/05','Standard','2005-05-21 to 2005-06-20','Visa','Rs.499');
INSERT INTO Invoice(Invoice_number,Customer_id,Sign_up_date,Plan,Service_period,Payment_method,Total) VALUES (21402 ,31,'8/12/16','Basic','2016-08-12 to 2016-09-11','Visa','Rs.199');
INSERT INTO Invoice(Invoice_number,Customer_id,Sign_up_date,Plan,Service_period,Payment_method,Total) VALUES (01591 ,32,'9/5/00','Premium','2000-09-05 to 2000-10-05','Discover','Rs.649');
INSERT INTO Invoice(Invoice_number,Customer_id,Sign_up_date,Plan,Service_period,Payment_method,Total) VALUES (23325 ,33,'6/19/99','Premium','1999-06-19 to 1999-07-19','Discover','Rs.649');
INSERT INTO Invoice(Invoice_number,Customer_id,Sign_up_date,Plan,Service_period,Payment_method,Total) VALUES (64977 ,34,'7/7/01','Standard','2001-07-07 to 2001-08-06','AmericanExpress','Rs.499');
INSERT INTO Invoice(Invoice_number,Customer_id,Sign_up_date,Plan,Service_period,Payment_method,Total) VALUES (38206 ,35,'7/30/11','Standard','2011-07-30 to 2011-08-29','Visa','Rs.499');
INSERT INTO Invoice(Invoice_number,Customer_id,Sign_up_date,Plan,Service_period,Payment_method,Total) VALUES (67709,36,'9/21/17','Standard','2017-09-21 to 2017-10-21','Visa','Rs.499');
INSERT INTO Invoice(Invoice_number,Customer_id,Sign_up_date,Plan,Service_period,Payment_method,Total) VALUES (00386 ,37,'9/26/02','Premium','2002-09-26 to 2002-10-26','Discover','Rs.649');
INSERT INTO Invoice(Invoice_number,Customer_id,Sign_up_date,Plan,Service_period,Payment_method,Total) VALUES (32548 ,38,'9/11/05','Premium','2005-09-11 to 2005-10-11','MasterCard','Rs.499');
INSERT INTO Invoice(Invoice_number,Customer_id,Sign_up_date,Plan,Service_period,Payment_method,Total) VALUES (64229,39,'6/4/06','Standard','2006-06-04 to 2006-07-04','Visa','Rs.499');
INSERT INTO Invoice(Invoice_number,Customer_id,Sign_up_date,Plan,Service_period,Payment_method,Total) VALUES (28433,40,'11/13/14','Standard','2014-11-13 to 2014-12-13','Visa','Rs.649');
INSERT INTO Invoice(Invoice_number,Customer_id,Sign_up_date,Plan,Service_period,Payment_method,Total) VALUES (26831 ,41,'12/27/18','Basic','2018-12-27 to 2019-01-26','MasterCard','Rs.199');
INSERT INTO Invoice(Invoice_number,Customer_id,Sign_up_date,Plan,Service_period,Payment_method,Total) VALUES (52358,42,'3/18/16','Standard','2016-03-18 to 2016-04-17','MasterCard','Rs.499');
INSERT INTO Invoice(Invoice_number,Customer_id,Sign_up_date,Plan,Service_period,Payment_method,Total) VALUES (32364 ,43,'1/16/04','Basic','2004-01-16 to 2004-02-15','AmericanExpress','Rs.199');
INSERT INTO Invoice(Invoice_number,Customer_id,Sign_up_date,Plan,Service_period,Payment_method,Total) VALUES (66338 ,44,'6/27/01','Basic','2001-06-27 to 2001-07-27','AmericanExpress','Rs.199');
INSERT INTO Invoice(Invoice_number,Customer_id,Sign_up_date,Plan,Service_period,Payment_method,Total) VALUES (11187 ,45,'9/8/05','Standard','2005-09-08 to 2005-10-08','AmericanExpress','Rs.499');
INSERT INTO Invoice(Invoice_number,Customer_id,Sign_up_date,Plan,Service_period,Payment_method,Total) VALUES (30076,46,'3/21/09','Basic','2009-03-21 to 2009-04-20','Visa','Rs.199');
INSERT INTO Invoice(Invoice_number,Customer_id,Sign_up_date,Plan,Service_period,Payment_method,Total) VALUES (31850 ,47,'2/22/03','Premium','2003-02-22 to 2003-03-24','Discover','Rs.649');
INSERT INTO Invoice(Invoice_number,Customer_id,Sign_up_date,Plan,Service_period,Payment_method,Total) VALUES (94956,48,'6/27/18','Standard','2018-06-27 to 2018-07-27','MasterCard','Rs.499');
INSERT INTO Invoice(Invoice_number,Customer_id,Sign_up_date,Plan,Service_period,Payment_method,Total) VALUES (69109 ,49,'7/22/19','Premium','2019-07-22 to 2019-08-21','Discover','Rs.649');
INSERT INTO Invoice(Invoice_number,Customer_id,Sign_up_date,Plan,Service_period,Payment_method,Total) VALUES (49987 ,50,'6/23/19','Premium','2019-06-23 to 2019-07-23','MasterCard','Rs.649');
INSERT INTO Invoice(Invoice_number,Customer_id,Sign_up_date,Plan,Service_period,Payment_method,Total) VALUES (16087 ,51,'12/12/07','Basic','2007-12-12 to 2008-01-11','Discover','Rs.199');
INSERT INTO Invoice(Invoice_number,Customer_id,Sign_up_date,Plan,Service_period,Payment_method,Total) VALUES (35336 ,52,'6/14/12','Premium','2012-06-14 to 2012-07-14','AmericanExpress','Rs.499');
INSERT INTO Invoice(Invoice_number,Customer_id,Sign_up_date,Plan,Service_period,Payment_method,Total) VALUES (93694 ,53,'12/6/16','Basic','2016-12-06 to 2017-01-05','Discover','Rs.199');
INSERT INTO Invoice(Invoice_number,Customer_id,Sign_up_date,Plan,Service_period,Payment_method,Total) VALUES (64050 ,54,'11/23/01','Premium','2001-11-23 to 2001-12-23','Visa','Rs.649');
INSERT INTO Invoice(Invoice_number,Customer_id,Sign_up_date,Plan,Service_period,Payment_method,Total) VALUES (35446 ,55,'2/15/00','Standard','2000-02-15 to 2000-03-16','AmericanExpress','Rs.499');
INSERT INTO Invoice(Invoice_number,Customer_id,Sign_up_date,Plan,Service_period,Payment_method,Total) VALUES (17614 ,56,'8/11/09','Basic','2009-08-11 to 2009-09-10','Visa','Rs.199');
INSERT INTO Invoice(Invoice_number,Customer_id,Sign_up_date,Plan,Service_period,Payment_method,Total) VALUES (50793 ,57,'5/5/19','Premium','2019-05-05 to 2019-06-04','Visa','Rs.649');
INSERT INTO Invoice(Invoice_number,Customer_id,Sign_up_date,Plan,Service_period,Payment_method,Total) VALUES (05962,58,'9/21/13','Basic','2013-09-21 to 2013-10-21','MasterCard','Rs.199');
INSERT INTO Invoice(Invoice_number,Customer_id,Sign_up_date,Plan,Service_period,Payment_method,Total) VALUES (95086,59,'7/26/04','Premium','2004-07-26 to 2004-08-25','Visa','Rs.499');
INSERT INTO Invoice(Invoice_number,Customer_id,Sign_up_date,Plan,Service_period,Payment_method,Total) VALUES (07565 ,60,'9/22/07','Standard','2007-09-22 to 2007-10-22','Discover','Rs.649');
INSERT INTO Invoice(Invoice_number,Customer_id,Sign_up_date,Plan,Service_period,Payment_method,Total) VALUES (99322 ,61,'8/6/11','Premium','2011-08-06 to 2011-09-05','MasterCard','Rs.649');
INSERT INTO Invoice(Invoice_number,Customer_id,Sign_up_date,Plan,Service_period,Payment_method,Total) VALUES (30221 ,62,'7/12/10','Standard','2010-07-12 to 2010-08-11','Discover','Rs.499');
INSERT INTO Invoice(Invoice_number,Customer_id,Sign_up_date,Plan,Service_period,Payment_method,Total) VALUES (37762 ,63,'4/20/02','Premium','2002-04-20 to 2002-05-20','Discover','Rs.199');
INSERT INTO Invoice(Invoice_number,Customer_id,Sign_up_date,Plan,Service_period,Payment_method,Total) VALUES (58175 ,64,'8/8/16','Premium','2016-08-08 to 2016-09-07','Discover','Rs.649');
INSERT INTO Invoice(Invoice_number,Customer_id,Sign_up_date,Plan,Service_period,Payment_method,Total) VALUES (36579 ,65,'7/29/12','Basic','2012-07-29 to 2012-08-28','MasterCard','Rs.199');
INSERT INTO Invoice(Invoice_number,Customer_id,Sign_up_date,Plan,Service_period,Payment_method,Total) VALUES (76190 ,66,'8/28/09','Standard','2009-08-28 to 2009-09-27','AmericanExpress','Rs.499');
INSERT INTO Invoice(Invoice_number,Customer_id,Sign_up_date,Plan,Service_period,Payment_method,Total) VALUES (51639 ,67,'11/21/99','Premium','1999-11-21 to 1999-12-21','MasterCard','Rs.649');
INSERT INTO Invoice(Invoice_number,Customer_id,Sign_up_date,Plan,Service_period,Payment_method,Total) VALUES (86198 ,68,'9/1/13','Basic','2013-09-01 to 2013-10-01','Discover','Rs.499');
INSERT INTO Invoice(Invoice_number,Customer_id,Sign_up_date,Plan,Service_period,Payment_method,Total) VALUES (68551 ,69,'10/2/13','Basic','2013-10-02 to 2013-11-01','Discover','Rs.199');
INSERT INTO Invoice(Invoice_number,Customer_id,Sign_up_date,Plan,Service_period,Payment_method,Total) VALUES (57155 ,70,'5/3/19','Basic','2019-05-03 to 2019-06-02','AmericanExpress','Rs.199');
INSERT INTO Invoice(Invoice_number,Customer_id,Sign_up_date,Plan,Service_period,Payment_method,Total) VALUES (03105 ,71,'5/6/04','Basic','2004-05-06 to 2004-06-05','AmericanExpress','Rs.199');
INSERT INTO Invoice(Invoice_number,Customer_id,Sign_up_date,Plan,Service_period,Payment_method,Total) VALUES (73720 ,72,'1/27/12','Standard','2012-01-27 to 2012-02-26','Discover','Rs.649');
INSERT INTO Invoice(Invoice_number,Customer_id,Sign_up_date,Plan,Service_period,Payment_method,Total) VALUES (05229 ,73,'8/19/09','Standard','2009-08-19 to 2009-09-18','Discover','Rs.649');
INSERT INTO Invoice(Invoice_number,Customer_id,Sign_up_date,Plan,Service_period,Payment_method,Total) VALUES (74392 ,74,'4/9/01','Premium','2001-04-09 to 2001-05-09','MasterCard','Rs.499');
INSERT INTO Invoice(Invoice_number,Customer_id,Sign_up_date,Plan,Service_period,Payment_method,Total) VALUES (94583 ,75,'2/27/15','Basic','2015-02-27 to 2015-03-29','AmericanExpress','Rs.199');
INSERT INTO Invoice(Invoice_number,Customer_id,Sign_up_date,Plan,Service_period,Payment_method,Total) VALUES (94721 ,76,'8/29/04','Premium','2004-08-29 to 2004-09-28','Visa','Rs.649');
INSERT INTO Invoice(Invoice_number,Customer_id,Sign_up_date,Plan,Service_period,Payment_method,Total) VALUES (80921 ,77,'8/11/16','Basic','2016-08-11 to 2016-09-10','AmericanExpress','Rs.199');
INSERT INTO Invoice(Invoice_number,Customer_id,Sign_up_date,Plan,Service_period,Payment_method,Total) VALUES (56227,78,'10/5/02','Standard','2002-10-05 to 2002-11-04','AmericanExpress','Rs.499');
INSERT INTO Invoice(Invoice_number,Customer_id,Sign_up_date,Plan,Service_period,Payment_method,Total) VALUES (47343 ,79,'12/1/13','Standard','2013-12-01 to 2013-12-31','MasterCard','Rs.499');
INSERT INTO Invoice(Invoice_number,Customer_id,Sign_up_date,Plan,Service_period,Payment_method,Total) VALUES (66640 ,80,'2/18/00','Premium','2000-02-18 to 2000-03-19','AmericanExpress','Rs.649');
INSERT INTO Invoice(Invoice_number,Customer_id,Sign_up_date,Plan,Service_period,Payment_method,Total) VALUES (99563 ,81,'11/21/08','Premium','2008-11-21 to 2008-12-21','MasterCard','Rs.649');
INSERT INTO Invoice(Invoice_number,Customer_id,Sign_up_date,Plan,Service_period,Payment_method,Total) VALUES (22101 ,82,'5/4/15','Basic','2015-05-04 to 2015-06-03','MasterCard','Rs.199');
INSERT INTO Invoice(Invoice_number,Customer_id,Sign_up_date,Plan,Service_period,Payment_method,Total) VALUES (09317 ,83,'7/4/04','Basic','2004-07-04 to 2004-08-03','Visa','Rs.199');
INSERT INTO Invoice(Invoice_number,Customer_id,Sign_up_date,Plan,Service_period,Payment_method,Total) VALUES (26934 ,84,'8/13/02','Standard','2002-08-13 to 2002-09-12','AmericanExpress','Rs.499');
INSERT INTO Invoice(Invoice_number,Customer_id,Sign_up_date,Plan,Service_period,Payment_method,Total) VALUES (05035 ,85,'6/10/06','Premium','2006-06-10 to 2006-07-10','MasterCard','Rs.649');
INSERT INTO Invoice(Invoice_number,Customer_id,Sign_up_date,Plan,Service_period,Payment_method,Total) VALUES (71628 ,86,'10/31/11','Premium','2011-10-31 to 2011-11-30','Visa','Rs.649');
INSERT INTO Invoice(Invoice_number,Customer_id,Sign_up_date,Plan,Service_period,Payment_method,Total) VALUES (87908 ,87,'12/29/05','Standard','2005-12-29 to 2006-01-28','MasterCard','Rs.199');
INSERT INTO Invoice(Invoice_number,Customer_id,Sign_up_date,Plan,Service_period,Payment_method,Total) VALUES (34641 ,88,'1/26/13','Premium','2013-01-26 to 2013-02-25','AmericanExpress','Rs.649');
INSERT INTO Invoice(Invoice_number,Customer_id,Sign_up_date,Plan,Service_period,Payment_method,Total) VALUES (76468 ,89,'5/18/00','Standard','2000-05-18 to 2000-06-17','AmericanExpress','Rs.499');
INSERT INTO Invoice(Invoice_number,Customer_id,Sign_up_date,Plan,Service_period,Payment_method,Total) VALUES (98662 ,90,'11/8/01','Premium','2001-11-08 to 2001-12-08','Discover','Rs.649');
INSERT INTO Invoice(Invoice_number,Customer_id,Sign_up_date,Plan,Service_period,Payment_method,Total) VALUES (07806 ,91,'10/29/12','Standard','2012-10-29 to 2012-11-28','Discover','Rs.499');
INSERT INTO Invoice(Invoice_number,Customer_id,Sign_up_date,Plan,Service_period,Payment_method,Total) VALUES (96947 ,92,'6/15/14','Standard','2014-06-15 to 2014-07-15','MasterCard','Rs.499');
INSERT INTO Invoice(Invoice_number,Customer_id,Sign_up_date,Plan,Service_period,Payment_method,Total) VALUES (48560 ,93,'1/24/05','Standard','2005-01-24 to 2005-02-23','MasterCard','Rs.499');
INSERT INTO Invoice(Invoice_number,Customer_id,Sign_up_date,Plan,Service_period,Payment_method,Total) VALUES (30359 ,94,'2/22/06','Basic','2006-02-22 to 2006-03-24','MasterCard','Rs.199');
INSERT INTO Invoice(Invoice_number,Customer_id,Sign_up_date,Plan,Service_period,Payment_method,Total) VALUES (93795 ,95,'9/12/99','Basic','1999-09-12 to 1999-10-12','Visa','Rs.199');
INSERT INTO Invoice(Invoice_number,Customer_id,Sign_up_date,Plan,Service_period,Payment_method,Total) VALUES (20741 ,96,'11/5/01','Standard','2001-11-05 to 2001-12-05','Visa','Rs.499');
INSERT INTO Invoice(Invoice_number,Customer_id,Sign_up_date,Plan,Service_period,Payment_method,Total) VALUES (56890 ,97,'2/6/09','Premium','2009-02-06 to 2009-03-08','AmericanExpress','Rs.649');
INSERT INTO Invoice(Invoice_number,Customer_id,Sign_up_date,Plan,Service_period,Payment_method,Total) VALUES (91235 ,98,'10/8/99','Basic','1999-10-08 to 1999-11-07','MasterCard','Rs.199');
INSERT INTO Invoice(Invoice_number,Customer_id,Sign_up_date,Plan,Service_period,Payment_method,Total) VALUES (78573,99,'4/11/15','Premium','2015-04-11 to 2015-05-11','AmericanExpress','Rs.649');
INSERT INTO Invoice(Invoice_number,Customer_id,Sign_up_date,Plan,Service_period,Payment_method,Total) VALUES (89184,100,'1/10/17','Standard','2017-01-10 to 2017-02-09','AmericanExpress','Rs.199');


insert into streams (Stream_id, Customer_id, Content_id, Stream_date, Stream_time, Stream_duration, Stream_rating) values (1, 38, 98, '2021-09-04', '8:39 PM', 22, 3);
insert into streams (Stream_id, Customer_id, Content_id, Stream_date, Stream_time, Stream_duration, Stream_rating) values (2, 48, 91, '2022-08-22', '8:39 PM', 22, 3);
insert into streams (Stream_id, Customer_id, Content_id, Stream_date, Stream_time, Stream_duration, Stream_rating) values (3, 92, 2, '2021-01-25', '9:47 PM', 85, 3);
insert into streams (Stream_id, Customer_id, Content_id, Stream_date, Stream_time, Stream_duration, Stream_rating) values (4, 85, 63, '2021-01-17', '5:53 PM', 5, 2);
insert into streams (Stream_id, Customer_id, Content_id, Stream_date, Stream_time, Stream_duration, Stream_rating) values (5, 72, 1, '2022-11-15', '9:51 AM', 44, 1);
insert into streams (Stream_id, Customer_id, Content_id, Stream_date, Stream_time, Stream_duration, Stream_rating) values (6, 88, 70, '2021-10-29', '12:49 PM', 5, 4);
insert into streams (Stream_id, Customer_id, Content_id, Stream_date, Stream_time, Stream_duration, Stream_rating) values (8, 26, 83, '2022-10-19', '5:04 PM', 84, 2);
insert into streams (Stream_id, Customer_id, Content_id, Stream_date, Stream_time, Stream_duration, Stream_rating) values (9, 86, 30, '2021-10-26', '7:45 AM', 28, 5);
insert into streams (Stream_id, Customer_id, Content_id, Stream_date, Stream_time, Stream_duration, Stream_rating) values (10, 3, 69, '2021-01-30', '2:17 PM', 49, 3);
insert into streams (Stream_id, Customer_id, Content_id, Stream_date, Stream_time, Stream_duration, Stream_rating) values (11, 60, 40, '2021-10-25', '10:17 PM', 62, 5);
insert into streams (Stream_id, Customer_id, Content_id, Stream_date, Stream_time, Stream_duration, Stream_rating) values (12, 58, 47, '2021-07-06', '5:34 AM', 70, 5);
insert into streams (Stream_id, Customer_id, Content_id, Stream_date, Stream_time, Stream_duration, Stream_rating) values (13, 53, 33, '2021-09-23', '8:02 PM', 12, 3);
insert into streams (Stream_id, Customer_id, Content_id, Stream_date, Stream_time, Stream_duration, Stream_rating) values (14, 43, 69, '2021-07-20', '1:29 AM', 53, 4);
insert into streams (Stream_id, Customer_id, Content_id, Stream_date, Stream_time, Stream_duration, Stream_rating) values (15, 90, 49, '2021-10-20', '12:06 PM', 49, 1);
insert into streams (Stream_id, Customer_id, Content_id, Stream_date, Stream_time, Stream_duration, Stream_rating) values (16, 13, 89, '2021-10-20', '8:02 PM', 29, 5);
insert into streams (Stream_id, Customer_id, Content_id, Stream_date, Stream_time, Stream_duration, Stream_rating) values (17, 3, 57, '2021-03-30', '11:31 AM', 32, 5);
insert into streams (Stream_id, Customer_id, Content_id, Stream_date, Stream_time, Stream_duration, Stream_rating) values (18, 28, 14, '2022-11-20', '12:41 AM', 33, 2);
insert into streams (Stream_id, Customer_id, Content_id, Stream_date, Stream_time, Stream_duration, Stream_rating) values (19, 2, 2, '2022-06-24', '8:04 PM', 50, 4);
insert into streams (Stream_id, Customer_id, Content_id, Stream_date, Stream_time, Stream_duration, Stream_rating) values (20, 88, 67, '2021-04-18', '10:38 AM', 53, 1);
insert into streams (Stream_id, Customer_id, Content_id, Stream_date, Stream_time, Stream_duration, Stream_rating) values (21, 17, 46, '2021-03-26', '6:40 PM', 83, 5);
insert into streams (Stream_id, Customer_id, Content_id, Stream_date, Stream_time, Stream_duration, Stream_rating) values (22, 66, 36, '2021-05-05', '3:17 AM', 74, 3);
insert into streams (Stream_id, Customer_id, Content_id, Stream_date, Stream_time, Stream_duration, Stream_rating) values (23, 5, 81, '2021-04-17', '6:34 AM', 7, 5);
insert into streams (Stream_id, Customer_id, Content_id, Stream_date, Stream_time, Stream_duration, Stream_rating) values (24, 25, 93, '2021-08-28', '7:24 AM', 77, 1);
insert into streams (Stream_id, Customer_id, Content_id, Stream_date, Stream_time, Stream_duration, Stream_rating) values (25, 58, 95, '2022-10-02', '3:12 PM', 17, 4);
insert into streams (Stream_id, Customer_id, Content_id, Stream_date, Stream_time, Stream_duration, Stream_rating) values (26, 30, 37, '2022-12-14', '4:41 AM', 77, 3);
insert into streams (Stream_id, Customer_id, Content_id, Stream_date, Stream_time, Stream_duration, Stream_rating) values (27, 59, 91, '2022-03-28', '11:33 AM', 57, 2);
insert into streams (Stream_id, Customer_id, Content_id, Stream_date, Stream_time, Stream_duration, Stream_rating) values (28, 48, 91, '2021-09-04', '8:39 PM', 22, 3);
insert into streams (Stream_id, Customer_id, Content_id, Stream_date, Stream_time, Stream_duration, Stream_rating) values (29, 2, 81, '2021-08-23', '7:33 PM', 55, 4);
insert into streams (Stream_id, Customer_id, Content_id, Stream_date, Stream_time, Stream_duration, Stream_rating) values (30, 31, 18, '2021-06-24', '4:11 AM', 64, 3);
insert into streams (Stream_id, Customer_id, Content_id, Stream_date, Stream_time, Stream_duration, Stream_rating) values (31, 65, 55, '2021-04-27', '3:31 PM', 9, 3);
insert into streams (Stream_id, Customer_id, Content_id, Stream_date, Stream_time, Stream_duration, Stream_rating) values (32, 99, 60, '2021-04-22', '11:20 AM', 4, 3);
insert into streams (Stream_id, Customer_id, Content_id, Stream_date, Stream_time, Stream_duration, Stream_rating) values (33, 88, 64, '2021-04-24', '2:23 AM', 75, 4);
insert into streams (Stream_id, Customer_id, Content_id, Stream_date, Stream_time, Stream_duration, Stream_rating) values (34, 31, 96, '2022-11-28', '8:29 PM', 5, 2);
insert into streams (Stream_id, Customer_id, Content_id, Stream_date, Stream_time, Stream_duration, Stream_rating) values (35, 88, 89, '2022-05-13', '4:01 AM', 91, 3);
insert into streams (Stream_id, Customer_id, Content_id, Stream_date, Stream_time, Stream_duration, Stream_rating) values (36, 96, 24, '2022-07-24', '10:53 AM', 93, 2);
insert into streams (Stream_id, Customer_id, Content_id, Stream_date, Stream_time, Stream_duration, Stream_rating) values (37, 66, 57, '2021-02-19', '3:44 AM', 59, 3);
insert into streams (Stream_id, Customer_id, Content_id, Stream_date, Stream_time, Stream_duration, Stream_rating) values (38, 14, 93, '2021-03-18', '4:42 AM', 2, 1);
insert into streams (Stream_id, Customer_id, Content_id, Stream_date, Stream_time, Stream_duration, Stream_rating) values (39, 66, 40, '2021-12-21', '1:12 PM', 30, 3);
insert into streams (Stream_id, Customer_id, Content_id, Stream_date, Stream_time, Stream_duration, Stream_rating) values (40, 94, 84, '2021-06-07', '10:52 PM', 21, 3);
insert into streams (Stream_id, Customer_id, Content_id, Stream_date, Stream_time, Stream_duration, Stream_rating) values (41, 76, 5, '2021-06-26', '12:38 AM', 5, 2);
insert into streams (Stream_id, Customer_id, Content_id, Stream_date, Stream_time, Stream_duration, Stream_rating) values (42, 34, 36, '2021-12-30', '6:43 PM', 22, 1);
insert into streams (Stream_id, Customer_id, Content_id, Stream_date, Stream_time, Stream_duration, Stream_rating) values (43, 76, 48, '2021-06-06', '2:21 AM', 33, 4);
insert into streams (Stream_id, Customer_id, Content_id, Stream_date, Stream_time, Stream_duration, Stream_rating) values (44, 48, 26, '2021-05-16', '3:25 PM', 21, 4);
insert into streams (Stream_id, Customer_id, Content_id, Stream_date, Stream_time, Stream_duration, Stream_rating) values (45, 7, 63, '2021-02-13', '6:24 AM', 36, 1);
insert into streams (Stream_id, Customer_id, Content_id, Stream_date, Stream_time, Stream_duration, Stream_rating) values (46, 64, 89, '2021-09-29', '4:47 PM', 56, 5);
insert into streams (Stream_id, Customer_id, Content_id, Stream_date, Stream_time, Stream_duration, Stream_rating) values (47, 47, 100, '2022-06-30', '9:08 PM', 53, 5);
insert into streams (Stream_id, Customer_id, Content_id, Stream_date, Stream_time, Stream_duration, Stream_rating) values (48, 94, 58, '2022-08-13', '11:44 AM', 48, 4);
insert into streams (Stream_id, Customer_id, Content_id, Stream_date, Stream_time, Stream_duration, Stream_rating) values (49, 25, 54, '2022-02-10', '6:47 PM', 87, 3);
insert into streams (Stream_id, Customer_id, Content_id, Stream_date, Stream_time, Stream_duration, Stream_rating) values (50, 78, 96, '2022-10-05', '1:06 AM', 28, 5);
insert into streams (Stream_id, Customer_id, Content_id, Stream_date, Stream_time, Stream_duration, Stream_rating) values (51, 89, 5, '2021-06-08', '1:39 PM', 54, 3);
insert into streams (Stream_id, Customer_id, Content_id, Stream_date, Stream_time, Stream_duration, Stream_rating) values (52, 8, 18, '2021-07-08', '1:56 AM', 4, 5);
insert into streams (Stream_id, Customer_id, Content_id, Stream_date, Stream_time, Stream_duration, Stream_rating) values (53, 45, 14, '2021-08-12', '2:01 AM', 15, 3);
insert into streams (Stream_id, Customer_id, Content_id, Stream_date, Stream_time, Stream_duration, Stream_rating) values (54, 18, 84, '2021-06-06', '3:00 PM', 73, 4);
insert into streams (Stream_id, Customer_id, Content_id, Stream_date, Stream_time, Stream_duration, Stream_rating) values (55, 67, 39, '2021-10-09', '8:24 AM', 90, 2);
insert into streams (Stream_id, Customer_id, Content_id, Stream_date, Stream_time, Stream_duration, Stream_rating) values (56, 45, 50, '2021-03-02', '8:19 AM', 51, 5);
insert into streams (Stream_id, Customer_id, Content_id, Stream_date, Stream_time, Stream_duration, Stream_rating) values (57, 35, 91, '2021-07-07', '12:58 AM', 83, 2);
insert into streams (Stream_id, Customer_id, Content_id, Stream_date, Stream_time, Stream_duration, Stream_rating) values (58, 66, 2, '2021-09-29', '5:59 PM', 40, 1);
insert into streams (Stream_id, Customer_id, Content_id, Stream_date, Stream_time, Stream_duration, Stream_rating) values (59, 36, 5, '2021-12-04', '7:50 PM', 55, 3);
insert into streams (Stream_id, Customer_id, Content_id, Stream_date, Stream_time, Stream_duration, Stream_rating) values (60, 94, 53, '2021-08-16', '4:55 PM', 46, 4);
insert into streams (Stream_id, Customer_id, Content_id, Stream_date, Stream_time, Stream_duration, Stream_rating) values (61, 100, 29, '2021-05-02', '5:03 PM', 82, 4);
insert into streams (Stream_id, Customer_id, Content_id, Stream_date, Stream_time, Stream_duration, Stream_rating) values (62, 91, 18, '2021-05-18', '3:30 PM', 19, 5);
insert into streams (Stream_id, Customer_id, Content_id, Stream_date, Stream_time, Stream_duration, Stream_rating) values (63, 62, 19, '2021-03-16', '6:09 AM', 62, 3);
insert into streams (Stream_id, Customer_id, Content_id, Stream_date, Stream_time, Stream_duration, Stream_rating) values (64, 100, 94, '2021-04-10', '12:03 PM', 85, 4);
insert into streams (Stream_id, Customer_id, Content_id, Stream_date, Stream_time, Stream_duration, Stream_rating) values (65, 50, 74, '2021-10-28', '10:34 AM', 41, 1);
insert into streams (Stream_id, Customer_id, Content_id, Stream_date, Stream_time, Stream_duration, Stream_rating) values (66, 70, 31, '2021-10-12', '7:02 PM', 85, 2);
insert into streams (Stream_id, Customer_id, Content_id, Stream_date, Stream_time, Stream_duration, Stream_rating) values (67, 35, 73, '2021-11-13', '3:36 PM', 93, 1);
insert into streams (Stream_id, Customer_id, Content_id, Stream_date, Stream_time, Stream_duration, Stream_rating) values (68, 45, 31, '2021-02-22', '6:03 PM', 77, 3);
insert into streams (Stream_id, Customer_id, Content_id, Stream_date, Stream_time, Stream_duration, Stream_rating) values (69, 21, 69, '2021-10-11', '6:37 PM', 51, 4);
insert into streams (Stream_id, Customer_id, Content_id, Stream_date, Stream_time, Stream_duration, Stream_rating) values (70, 17, 34, '2021-06-18', '7:04 PM', 45, 3);
insert into streams (Stream_id, Customer_id, Content_id, Stream_date, Stream_time, Stream_duration, Stream_rating) values (71, 55, 40, '2021-09-17', '11:33 AM', 47, 3);
insert into streams (Stream_id, Customer_id, Content_id, Stream_date, Stream_time, Stream_duration, Stream_rating) values (72, 96, 8, '2021-08-22', '11:03 PM', 2, 1);
insert into streams (Stream_id, Customer_id, Content_id, Stream_date, Stream_time, Stream_duration, Stream_rating) values (73, 95, 40, '2021-12-28', '10:27 PM', 97, 2);
insert into streams (Stream_id, Customer_id, Content_id, Stream_date, Stream_time, Stream_duration, Stream_rating) values (74, 95, 84, '2021-02-13', '4:20 AM', 53, 2);
insert into streams (Stream_id, Customer_id, Content_id, Stream_date, Stream_time, Stream_duration, Stream_rating) values (75, 42, 73, '2021-02-22', '11:55 AM', 95, 5);
insert into streams (Stream_id, Customer_id, Content_id, Stream_date, Stream_time, Stream_duration, Stream_rating) values (76, 74, 71, '2021-10-03', '8:23 PM', 50, 5);
insert into streams (Stream_id, Customer_id, Content_id, Stream_date, Stream_time, Stream_duration, Stream_rating) values (77, 22, 31, '2021-06-27', '6:16 PM', 36, 1);
insert into streams (Stream_id, Customer_id, Content_id, Stream_date, Stream_time, Stream_duration, Stream_rating) values (78, 30, 63, '2021-05-14', '4:21 PM', 49, 3);
insert into streams (Stream_id, Customer_id, Content_id, Stream_date, Stream_time, Stream_duration, Stream_rating) values (79, 10, 33, '2021-08-31', '5:16 PM', 5, 4);
insert into streams (Stream_id, Customer_id, Content_id, Stream_date, Stream_time, Stream_duration, Stream_rating) values (80, 21, 79, '2021-10-22', '12:59 AM', 67, 1);
insert into streams (Stream_id, Customer_id, Content_id, Stream_date, Stream_time, Stream_duration, Stream_rating) values (81, 69, 73, '2021-03-03', '12:22 AM', 93, 5);
insert into streams (Stream_id, Customer_id, Content_id, Stream_date, Stream_time, Stream_duration, Stream_rating) values (82, 74, 99, '2021-11-11', '7:58 PM', 39, 4);
insert into streams (Stream_id, Customer_id, Content_id, Stream_date, Stream_time, Stream_duration, Stream_rating) values (83, 36, 19, '2021-08-16', '6:35 PM', 3, 3);
insert into streams (Stream_id, Customer_id, Content_id, Stream_date, Stream_time, Stream_duration, Stream_rating) values (84, 93, 27, '2021-11-25', '12:58 AM', 47, 1);
insert into streams (Stream_id, Customer_id, Content_id, Stream_date, Stream_time, Stream_duration, Stream_rating) values (85, 64, 40, '2021-02-27', '1:01 AM', 8, 3);
insert into streams (Stream_id, Customer_id, Content_id, Stream_date, Stream_time, Stream_duration, Stream_rating) values (86, 97, 47, '2021-11-24', '4:08 PM', 68, 3);
insert into streams (Stream_id, Customer_id, Content_id, Stream_date, Stream_time, Stream_duration, Stream_rating) values (87, 26, 61, '2021-08-20', '9:20 PM', 100, 4);
insert into streams (Stream_id, Customer_id, Content_id, Stream_date, Stream_time, Stream_duration, Stream_rating) values (88, 93, 50, '2021-07-28', '12:38 AM', 7, 4);
insert into streams (Stream_id, Customer_id, Content_id, Stream_date, Stream_time, Stream_duration, Stream_rating) values (89, 49, 17, '2021-08-02', '6:42 PM', 19, 5);
insert into streams (Stream_id, Customer_id, Content_id, Stream_date, Stream_time, Stream_duration, Stream_rating) values (90, 77, 36, '2021-07-13', '5:30 AM', 43, 3);
insert into streams (Stream_id, Customer_id, Content_id, Stream_date, Stream_time, Stream_duration, Stream_rating) values (91, 61, 5, '2022-12-18', '4:37 PM', 6, 1);
insert into streams (Stream_id, Customer_id, Content_id, Stream_date, Stream_time, Stream_duration, Stream_rating) values (92, 68, 84, '2021-10-25', '9:41 PM', 76, 5);
insert into streams (Stream_id, Customer_id, Content_id, Stream_date, Stream_time, Stream_duration, Stream_rating) values (93, 67, 5, '2021-10-22', '6:12 AM', 31, 5);
insert into streams (Stream_id, Customer_id, Content_id, Stream_date, Stream_time, Stream_duration, Stream_rating) values (94, 8, 34, '2021-05-17', '3:48 AM', 31, 3);
insert into streams (Stream_id, Customer_id, Content_id, Stream_date, Stream_time, Stream_duration, Stream_rating) values (95, 72, 52, '2021-04-15', '3:09 AM', 69, 4);
insert into streams (Stream_id, Customer_id, Content_id, Stream_date, Stream_time, Stream_duration, Stream_rating) values (96, 54, 95, '2021-05-22', '5:34 AM', 95, 1);
insert into streams (Stream_id, Customer_id, Content_id, Stream_date, Stream_time, Stream_duration, Stream_rating) values (97, 2, 18, '2021-09-21', '7:19 AM', 80, 1);
insert into streams (Stream_id, Customer_id, Content_id, Stream_date, Stream_time, Stream_duration, Stream_rating) values (98, 95, 83, '2021-12-09', '2:05 PM', 95, 5);
insert into streams (Stream_id, Customer_id, Content_id, Stream_date, Stream_time, Stream_duration, Stream_rating) values (99, 31, 96, '2021-02-06', '11:55 AM', 9, 1);
insert into streams (Stream_id, Customer_id, Content_id, Stream_date, Stream_time, Stream_duration, Stream_rating) values (100, 58, 2, '2021-06-03', '2:08 PM', 26, 5);
insert into streams (Stream_id, Customer_id, Content_id, Stream_date, Stream_time, Stream_duration, Stream_rating) values (101, 92, 72, '2021-06-13', '9:08 PM', 87, 1);
insert into streams (Stream_id, Customer_id, Content_id, Stream_date, Stream_time, Stream_duration, Stream_rating) values (102, 91, 25, '2021-01-18', '4:51 PM', 61, 3);
insert into streams (Stream_id, Customer_id, Content_id, Stream_date, Stream_time, Stream_duration, Stream_rating) values (103, 91, 91, '2022-12-25', '1:29 AM', 22, 5);
insert into streams (Stream_id, Customer_id, Content_id, Stream_date, Stream_time, Stream_duration, Stream_rating) values (104, 18, 53, '2022-12-11', '6:26 PM', 98, 4);
insert into streams (Stream_id, Customer_id, Content_id, Stream_date, Stream_time, Stream_duration, Stream_rating) values (105, 100, 23, '2021-04-02', '11:54 PM', 77, 5);
insert into streams (Stream_id, Customer_id, Content_id, Stream_date, Stream_time, Stream_duration, Stream_rating) values (106, 69, 57, '2021-05-01', '7:54 PM', 68, 4);
insert into streams (Stream_id, Customer_id, Content_id, Stream_date, Stream_time, Stream_duration, Stream_rating) values (107, 21, 44, '2021-07-06', '5:12 AM', 43, 3);
insert into streams (Stream_id, Customer_id, Content_id, Stream_date, Stream_time, Stream_duration, Stream_rating) values (108, 19, 88, '2021-09-09', '9:28 PM', 33, 1);
insert into streams (Stream_id, Customer_id, Content_id, Stream_date, Stream_time, Stream_duration, Stream_rating) values (109, 83, 20, '2021-01-17', '11:38 PM', 49, 5);
insert into streams (Stream_id, Customer_id, Content_id, Stream_date, Stream_time, Stream_duration, Stream_rating) values (110, 58, 73, '2021-05-18', '2:37 AM', 41, 1);
insert into streams (Stream_id, Customer_id, Content_id, Stream_date, Stream_time, Stream_duration, Stream_rating) values (111, 66, 85, '2022-12-19', '3:34 AM', 50, 2);
insert into streams (Stream_id, Customer_id, Content_id, Stream_date, Stream_time, Stream_duration, Stream_rating) values (112, 94, 93, '2021-01-13', '12:46 AM', 29, 1);
insert into streams (Stream_id, Customer_id, Content_id, Stream_date, Stream_time, Stream_duration, Stream_rating) values (113, 8, 27, '2021-04-20', '11:36 PM', 39, 3);
insert into streams (Stream_id, Customer_id, Content_id, Stream_date, Stream_time, Stream_duration, Stream_rating) values (114, 96, 70, '2021-05-19', '6:07 PM', 86, 2);
insert into streams (Stream_id, Customer_id, Content_id, Stream_date, Stream_time, Stream_duration, Stream_rating) values (115, 17, 94, '2021-11-04', '1:04 AM', 34, 4);
insert into streams (Stream_id, Customer_id, Content_id, Stream_date, Stream_time, Stream_duration, Stream_rating) values (116, 29, 2, '2021-02-27', '5:00 AM', 44, 2);
insert into streams (Stream_id, Customer_id, Content_id, Stream_date, Stream_time, Stream_duration, Stream_rating) values (117, 86, 15, '2021-02-02', '1:58 AM', 69, 5);
insert into streams (Stream_id, Customer_id, Content_id, Stream_date, Stream_time, Stream_duration, Stream_rating) values (118, 90, 7, '2021-03-14', '2:23 PM', 22, 3);
insert into streams (Stream_id, Customer_id, Content_id, Stream_date, Stream_time, Stream_duration, Stream_rating) values (119, 21, 52, '2021-08-14', '9:06 AM', 27, 2);
insert into streams (Stream_id, Customer_id, Content_id, Stream_date, Stream_time, Stream_duration, Stream_rating) values (120, 67, 56, '2021-03-12', '3:43 AM', 16, 5);
insert into streams (Stream_id, Customer_id, Content_id, Stream_date, Stream_time, Stream_duration, Stream_rating) values (121, 63, 54, '2021-05-17', '1:39 PM', 70, 2);
insert into streams (Stream_id, Customer_id, Content_id, Stream_date, Stream_time, Stream_duration, Stream_rating) values (122, 25, 22, '2022-12-27', '7:02 PM', 19, 1);
insert into streams (Stream_id, Customer_id, Content_id, Stream_date, Stream_time, Stream_duration, Stream_rating) values (123, 39, 31, '2021-07-30', '6:47 AM', 21, 4);
insert into streams (Stream_id, Customer_id, Content_id, Stream_date, Stream_time, Stream_duration, Stream_rating) values (124, 29, 21, '2021-05-13', '4:41 PM', 56, 5);
insert into streams (Stream_id, Customer_id, Content_id, Stream_date, Stream_time, Stream_duration, Stream_rating) values (125, 32, 78, '2021-09-17', '9:23 PM', 92, 1);
insert into streams (Stream_id, Customer_id, Content_id, Stream_date, Stream_time, Stream_duration, Stream_rating) values (126, 75, 2, '2021-09-25', '7:51 PM', 1, 5);
insert into streams (Stream_id, Customer_id, Content_id, Stream_date, Stream_time, Stream_duration, Stream_rating) values (127, 71, 37, '2021-03-11', '9:12 AM', 93, 4);
insert into streams (Stream_id, Customer_id, Content_id, Stream_date, Stream_time, Stream_duration, Stream_rating) values (128, 52, 69, '2021-04-03', '6:47 PM', 77, 4);
insert into streams (Stream_id, Customer_id, Content_id, Stream_date, Stream_time, Stream_duration, Stream_rating) values (129, 76, 80, '2021-02-01', '7:52 PM', 69, 1);
insert into streams (Stream_id, Customer_id, Content_id, Stream_date, Stream_time, Stream_duration, Stream_rating) values (130, 68, 52, '2021-09-30', '4:08 AM', 21, 2);
insert into streams (Stream_id, Customer_id, Content_id, Stream_date, Stream_time, Stream_duration, Stream_rating) values (131, 96, 74, '2021-08-27', '1:07 PM', 8, 5);
insert into streams (Stream_id, Customer_id, Content_id, Stream_date, Stream_time, Stream_duration, Stream_rating) values (132, 63, 95, '2022-12-01', '7:33 AM', 22, 1);
insert into streams (Stream_id, Customer_id, Content_id, Stream_date, Stream_time, Stream_duration, Stream_rating) values (133, 81, 83, '2021-01-24', '8:02 PM', 16, 3);
insert into streams (Stream_id, Customer_id, Content_id, Stream_date, Stream_time, Stream_duration, Stream_rating) values (134, 36, 87, '2021-08-18', '4:44 AM', 71, 2);
insert into streams (Stream_id, Customer_id, Content_id, Stream_date, Stream_time, Stream_duration, Stream_rating) values (135, 11, 15, '2021-02-19', '7:26 PM', 28, 1);
insert into streams (Stream_id, Customer_id, Content_id, Stream_date, Stream_time, Stream_duration, Stream_rating) values (136, 58, 4, '2022-11-12', '5:44 AM', 65, 5);
insert into streams (Stream_id, Customer_id, Content_id, Stream_date, Stream_time, Stream_duration, Stream_rating) values (137, 32, 99, '2021-05-04', '2:59 PM', 98, 1);
insert into streams (Stream_id, Customer_id, Content_id, Stream_date, Stream_time, Stream_duration, Stream_rating) values (138, 44, 86, '2021-05-31', '4:07 PM', 8, 5);
insert into streams (Stream_id, Customer_id, Content_id, Stream_date, Stream_time, Stream_duration, Stream_rating) values (139, 55, 21, '2022-11-11', '2:27 AM', 17, 1);
insert into streams (Stream_id, Customer_id, Content_id, Stream_date, Stream_time, Stream_duration, Stream_rating) values (140, 25, 22, '2021-10-27', '10:35 AM', 2, 5);
insert into streams (Stream_id, Customer_id, Content_id, Stream_date, Stream_time, Stream_duration, Stream_rating) values (142, 52, 63, '2021-09-03', '10:40 PM', 2, 2);
insert into streams (Stream_id, Customer_id, Content_id, Stream_date, Stream_time, Stream_duration, Stream_rating) values (143, 10, 19, '2021-10-20', '1:38 PM', 91, 4);
insert into streams (Stream_id, Customer_id, Content_id, Stream_date, Stream_time, Stream_duration, Stream_rating) values (144, 52, 68, '2021-07-07', '8:37 PM', 4, 1);
insert into streams (Stream_id, Customer_id, Content_id, Stream_date, Stream_time, Stream_duration, Stream_rating) values (145, 95, 46, '2021-10-02', '6:43 PM', 35, 1);
insert into streams (Stream_id, Customer_id, Content_id, Stream_date, Stream_time, Stream_duration, Stream_rating) values (146, 47, 56, '2021-05-02', '9:50 PM', 63, 4);
insert into streams (Stream_id, Customer_id, Content_id, Stream_date, Stream_time, Stream_duration, Stream_rating) values (147, 28, 91, '2021-01-06', '4:18 PM', 49, 3);
insert into streams (Stream_id, Customer_id, Content_id, Stream_date, Stream_time, Stream_duration, Stream_rating) values (148, 5, 90, '2021-12-03', '5:36 PM', 16, 5);
insert into streams (Stream_id, Customer_id, Content_id, Stream_date, Stream_time, Stream_duration, Stream_rating) values (149, 54, 61, '2021-06-01', '10:36 PM', 39, 1);
insert into streams (Stream_id, Customer_id, Content_id, Stream_date, Stream_time, Stream_duration, Stream_rating) values (150, 77, 39, '2021-08-19', '3:23 PM', 79, 3);
insert into streams (Stream_id, Customer_id, Content_id, Stream_date, Stream_time, Stream_duration, Stream_rating) values (151, 27, 65, '2021-02-07', '1:13 AM', 36, 1);
insert into streams (Stream_id, Customer_id, Content_id, Stream_date, Stream_time, Stream_duration, Stream_rating) values (152, 73, 97, '2021-05-04', '7:27 PM', 26, 5);
insert into streams (Stream_id, Customer_id, Content_id, Stream_date, Stream_time, Stream_duration, Stream_rating) values (153, 16, 67, '2021-05-25', '10:48 AM', 14, 2);
insert into streams (Stream_id, Customer_id, Content_id, Stream_date, Stream_time, Stream_duration, Stream_rating) values (154, 80, 28, '2021-09-12', '2:41 AM', 43, 3);
insert into streams (Stream_id, Customer_id, Content_id, Stream_date, Stream_time, Stream_duration, Stream_rating) values (155, 42, 5, '2021-09-15', '6:11 AM', 77, 5);
insert into streams (Stream_id, Customer_id, Content_id, Stream_date, Stream_time, Stream_duration, Stream_rating) values (156, 42, 54, '2021-05-16', '11:06 PM', 50, 2);
insert into streams (Stream_id, Customer_id, Content_id, Stream_date, Stream_time, Stream_duration, Stream_rating) values (157, 24, 54, '2021-01-31', '1:58 AM', 35, 3);
insert into streams (Stream_id, Customer_id, Content_id, Stream_date, Stream_time, Stream_duration, Stream_rating) values (158, 13, 71, '2021-09-04', '11:58 PM', 22, 1);
insert into streams (Stream_id, Customer_id, Content_id, Stream_date, Stream_time, Stream_duration, Stream_rating) values (159, 48, 21, '2022-11-12', '1:46 PM', 9, 5);
insert into streams (Stream_id, Customer_id, Content_id, Stream_date, Stream_time, Stream_duration, Stream_rating) values (160, 51, 80, '2021-04-21', '9:33 PM', 26, 2);
insert into streams (Stream_id, Customer_id, Content_id, Stream_date, Stream_time, Stream_duration, Stream_rating) values (161, 70, 7, '2021-01-22', '2:59 AM', 2, 5);
insert into streams (Stream_id, Customer_id, Content_id, Stream_date, Stream_time, Stream_duration, Stream_rating) values (164, 48, 90, '2021-10-03', '10:39 AM', 15, 1);
insert into streams (Stream_id, Customer_id, Content_id, Stream_date, Stream_time, Stream_duration, Stream_rating) values (165, 55, 63, '2022-12-12', '9:02 PM', 16, 5);
insert into streams (Stream_id, Customer_id, Content_id, Stream_date, Stream_time, Stream_duration, Stream_rating) values (166, 53, 25, '2022-11-20', '10:34 AM', 81, 5);
insert into streams (Stream_id, Customer_id, Content_id, Stream_date, Stream_time, Stream_duration, Stream_rating) values (167, 39, 37, '2021-03-27', '1:22 AM', 34, 4);
insert into streams (Stream_id, Customer_id, Content_id, Stream_date, Stream_time, Stream_duration, Stream_rating) values (168, 56, 98, '2021-01-03', '12:14 AM', 58, 1);
insert into streams (Stream_id, Customer_id, Content_id, Stream_date, Stream_time, Stream_duration, Stream_rating) values (169, 49, 26, '2022-12-01', '7:32 AM', 23, 1);
insert into streams (Stream_id, Customer_id, Content_id, Stream_date, Stream_time, Stream_duration, Stream_rating) values (170, 47, 65, '2022-12-16', '9:20 AM', 12, 4);
insert into streams (Stream_id, Customer_id, Content_id, Stream_date, Stream_time, Stream_duration, Stream_rating) values (171, 13, 40, '2021-04-03', '11:19 PM', 74, 3);
insert into streams (Stream_id, Customer_id, Content_id, Stream_date, Stream_time, Stream_duration, Stream_rating) values (172, 95, 10, '2021-07-12', '8:03 PM', 38, 3);
insert into streams (Stream_id, Customer_id, Content_id, Stream_date, Stream_time, Stream_duration, Stream_rating) values (173, 78, 13, '2021-07-19', '2:41 AM', 65, 5);
insert into streams (Stream_id, Customer_id, Content_id, Stream_date, Stream_time, Stream_duration, Stream_rating) values (174, 61, 88, '2021-06-02', '12:51 PM', 59, 5);
insert into streams (Stream_id, Customer_id, Content_id, Stream_date, Stream_time, Stream_duration, Stream_rating) values (175, 30, 47, '2021-05-22', '8:37 AM', 5, 5);
insert into streams (Stream_id, Customer_id, Content_id, Stream_date, Stream_time, Stream_duration, Stream_rating) values (176, 68, 47, '2021-03-18', '6:48 AM', 37, 3);
insert into streams (Stream_id, Customer_id, Content_id, Stream_date, Stream_time, Stream_duration, Stream_rating) values (177, 65, 76, '2021-04-28', '11:55 AM', 72, 4);
insert into streams (Stream_id, Customer_id, Content_id, Stream_date, Stream_time, Stream_duration, Stream_rating) values (178, 37, 54, '2022-11-16', '8:48 AM', 75, 4);
insert into streams (Stream_id, Customer_id, Content_id, Stream_date, Stream_time, Stream_duration, Stream_rating) values (179, 33, 1, '2021-03-24', '3:12 PM', 90, 3);
insert into streams (Stream_id, Customer_id, Content_id, Stream_date, Stream_time, Stream_duration, Stream_rating) values (180, 76, 58, '2021-01-10', '6:34 PM', 9, 3);
insert into streams (Stream_id, Customer_id, Content_id, Stream_date, Stream_time, Stream_duration, Stream_rating) values (181, 85, 100, '2021-01-14', '2:45 PM', 73, 2);
insert into streams (Stream_id, Customer_id, Content_id, Stream_date, Stream_time, Stream_duration, Stream_rating) values (182, 47, 66, '2021-01-13', '3:40 AM', 72, 5);
insert into streams (Stream_id, Customer_id, Content_id, Stream_date, Stream_time, Stream_duration, Stream_rating) values (183, 50, 78, '2021-08-16', '1:12 AM', 38, 3);
insert into streams (Stream_id, Customer_id, Content_id, Stream_date, Stream_time, Stream_duration, Stream_rating) values (184, 13, 46, '2021-06-30', '11:29 PM', 39, 3);
insert into streams (Stream_id, Customer_id, Content_id, Stream_date, Stream_time, Stream_duration, Stream_rating) values (185, 96, 37, '2021-08-29', '5:22 AM', 96, 5);
insert into streams (Stream_id, Customer_id, Content_id, Stream_date, Stream_time, Stream_duration, Stream_rating) values (186, 18, 86, '2021-01-02', '1:29 AM', 91, 4);
insert into streams (Stream_id, Customer_id, Content_id, Stream_date, Stream_time, Stream_duration, Stream_rating) values (187, 33, 30, '2021-06-02', '2:15 PM', 1, 2);
insert into streams (Stream_id, Customer_id, Content_id, Stream_date, Stream_time, Stream_duration, Stream_rating) values (188, 87, 48, '2021-01-30', '10:19 AM', 76, 4);
insert into streams (Stream_id, Customer_id, Content_id, Stream_date, Stream_time, Stream_duration, Stream_rating) values (189, 69, 17, '2021-08-12', '10:38 AM', 65, 2);
insert into streams (Stream_id, Customer_id, Content_id, Stream_date, Stream_time, Stream_duration, Stream_rating) values (190, 33, 95, '2021-09-26', '6:29 PM', 64, 4);
insert into streams (Stream_id, Customer_id, Content_id, Stream_date, Stream_time, Stream_duration, Stream_rating) values (191, 14, 64, '2021-10-01', '3:23 PM', 59, 2);
insert into streams (Stream_id, Customer_id, Content_id, Stream_date, Stream_time, Stream_duration, Stream_rating) values (192, 62, 20, '2021-08-28', '5:50 PM', 83, 1);
insert into streams (Stream_id, Customer_id, Content_id, Stream_date, Stream_time, Stream_duration, Stream_rating) values (193, 29, 4, '2021-02-20', '8:05 PM', 51, 4);
insert into streams (Stream_id, Customer_id, Content_id, Stream_date, Stream_time, Stream_duration, Stream_rating) values (194, 24, 62, '2021-04-16', '2:38 AM', 24, 1);
insert into streams (Stream_id, Customer_id, Content_id, Stream_date, Stream_time, Stream_duration, Stream_rating) values (195, 17, 57, '2021-06-08', '10:20 AM', 16, 1);
insert into streams (Stream_id, Customer_id, Content_id, Stream_date, Stream_time, Stream_duration, Stream_rating) values (196, 13, 70, '2021-03-19', '4:48 AM', 14, 3);
insert into streams (Stream_id, Customer_id, Content_id, Stream_date, Stream_time, Stream_duration, Stream_rating) values (197, 11, 19, '2021-09-04', '7:06 PM', 99, 5);
insert into streams (Stream_id, Customer_id, Content_id, Stream_date, Stream_time, Stream_duration, Stream_rating) values (198, 58, 61, '2021-10-05', '4:12 PM', 71, 4);
insert into streams (Stream_id, Customer_id, Content_id, Stream_date, Stream_time, Stream_duration, Stream_rating) values (199, 2, 82, '2021-09-13', '12:21 PM', 41, 1);
insert into streams (Stream_id, Customer_id, Content_id, Stream_date, Stream_time, Stream_duration, Stream_rating) values (200, 58, 4, '2021-08-06', '8:28 PM', 30, 1);
insert into streams (Stream_id, Customer_id, Content_id, Stream_date, Stream_time, Stream_duration, Stream_rating) values (201, 47, 11, '2021-12-24', '6:02 AM', 74, 2);
insert into streams (Stream_id, Customer_id, Content_id, Stream_date, Stream_time, Stream_duration, Stream_rating) values (202, 88, 61, '2021-08-23', '1:42 PM', 48, 2);
insert into streams (Stream_id, Customer_id, Content_id, Stream_date, Stream_time, Stream_duration, Stream_rating) values (203, 24, 33, '2021-01-21', '5:36 PM', 93, 4);
insert into streams (Stream_id, Customer_id, Content_id, Stream_date, Stream_time, Stream_duration, Stream_rating) values (204, 43, 50, '2021-10-02', '8:20 AM', 74, 4);
insert into streams (Stream_id, Customer_id, Content_id, Stream_date, Stream_time, Stream_duration, Stream_rating) values (205, 29, 53, '2022-12-25', '9:50 AM', 9, 4);
insert into streams (Stream_id, Customer_id, Content_id, Stream_date, Stream_time, Stream_duration, Stream_rating) values (206, 96, 44, '2021-06-13', '7:49 AM', 35, 3);
insert into streams (Stream_id, Customer_id, Content_id, Stream_date, Stream_time, Stream_duration, Stream_rating) values (207, 3, 98, '2021-09-14', '7:06 AM', 49, 2);
insert into streams (Stream_id, Customer_id, Content_id, Stream_date, Stream_time, Stream_duration, Stream_rating) values (208, 50, 74, '2021-10-06', '8:59 AM', 81, 3);
insert into streams (Stream_id, Customer_id, Content_id, Stream_date, Stream_time, Stream_duration, Stream_rating) values (209, 39, 63, '2021-11-04', '2:28 AM', 30, 3);
insert into streams (Stream_id, Customer_id, Content_id, Stream_date, Stream_time, Stream_duration, Stream_rating) values (210, 42, 40, '2022-11-29', '1:45 PM', 12, 3);
insert into streams (Stream_id, Customer_id, Content_id, Stream_date, Stream_time, Stream_duration, Stream_rating) values (211, 94, 36, '2021-06-02', '7:53 PM', 40, 1);
insert into streams (Stream_id, Customer_id, Content_id, Stream_date, Stream_time, Stream_duration, Stream_rating) values (212, 1, 19, '2021-01-19', '1:35 AM', 72, 2);
insert into streams (Stream_id, Customer_id, Content_id, Stream_date, Stream_time, Stream_duration, Stream_rating) values (213, 84, 14, '2021-09-23', '2:38 PM', 16, 1);
insert into streams (Stream_id, Customer_id, Content_id, Stream_date, Stream_time, Stream_duration, Stream_rating) values (214, 84, 61, '2021-10-08', '4:49 PM', 11, 2);
insert into streams (Stream_id, Customer_id, Content_id, Stream_date, Stream_time, Stream_duration, Stream_rating) values (215, 15, 54, '2021-08-05', '6:01 PM', 92, 3);
insert into streams (Stream_id, Customer_id, Content_id, Stream_date, Stream_time, Stream_duration, Stream_rating) values (216, 86, 50, '2021-09-23', '9:41 PM', 40, 1);
insert into streams (Stream_id, Customer_id, Content_id, Stream_date, Stream_time, Stream_duration, Stream_rating) values (217, 19, 80, '2021-12-11', '8:38 AM', 55, 3);
insert into streams (Stream_id, Customer_id, Content_id, Stream_date, Stream_time, Stream_duration, Stream_rating) values (218, 23, 48, '2021-06-04', '2:30 PM', 87, 2);
insert into streams (Stream_id, Customer_id, Content_id, Stream_date, Stream_time, Stream_duration, Stream_rating) values (219, 86, 98, '2021-07-07', '10:46 AM', 26, 2);
insert into streams (Stream_id, Customer_id, Content_id, Stream_date, Stream_time, Stream_duration, Stream_rating) values (220, 13, 74, '2021-01-23', '4:49 PM', 24, 2);
insert into streams (Stream_id, Customer_id, Content_id, Stream_date, Stream_time, Stream_duration, Stream_rating) values (221, 85, 27, '2021-01-16', '8:56 AM', 61, 2);
insert into streams (Stream_id, Customer_id, Content_id, Stream_date, Stream_time, Stream_duration, Stream_rating) values (222, 99, 26, '2021-04-11', '4:07 PM', 25, 3);
insert into streams (Stream_id, Customer_id, Content_id, Stream_date, Stream_time, Stream_duration, Stream_rating) values (223, 48, 91, '2021-09-04', '8:39 PM', 22, 3);
insert into streams (Stream_id, Customer_id, Content_id, Stream_date, Stream_time, Stream_duration, Stream_rating) values (224, 39, 98, '2021-10-30', '12:53 PM', 50, 1);
insert into streams (Stream_id, Customer_id, Content_id, Stream_date, Stream_time, Stream_duration, Stream_rating) values (225, 63, 63, '2021-05-07 ', '6:02 PM', 21, 4);
insert into streams (Stream_id, Customer_id, Content_id, Stream_date, Stream_time, Stream_duration, Stream_rating) values (226, 50, 69, '2021-05-06', '1:16 PM', 66, 1);
insert into streams (Stream_id, Customer_id, Content_id, Stream_date, Stream_time, Stream_duration, Stream_rating) values (227, 94, 24, '2022-12-27', '10:08 AM', 27, 3);
insert into streams (Stream_id, Customer_id, Content_id, Stream_date, Stream_time, Stream_duration, Stream_rating) values (228, 60, 7, '2021-07-25', '1:09 PM', 82, 3);
insert into streams (Stream_id, Customer_id, Content_id, Stream_date, Stream_time, Stream_duration, Stream_rating) values (229, 30, 40, '2021-11-07', '11:30 AM', 79, 5);
insert into streams (Stream_id, Customer_id, Content_id, Stream_date, Stream_time, Stream_duration, Stream_rating) values (230, 37, 28, '2021-10-17', '11:41 PM', 83, 5);
insert into streams (Stream_id, Customer_id, Content_id, Stream_date, Stream_time, Stream_duration, Stream_rating) values (231, 13, 64, '2021-06-09', '9:13 PM', 73, 2);
insert into streams (Stream_id, Customer_id, Content_id, Stream_date, Stream_time, Stream_duration, Stream_rating) values (232, 54, 100, '2021-03-02', '3:36 PM', 81, 3);
insert into streams (Stream_id, Customer_id, Content_id, Stream_date, Stream_time, Stream_duration, Stream_rating) values (233, 57, 72, '2021-07-09', '8:01 PM', 35, 5);
insert into streams (Stream_id, Customer_id, Content_id, Stream_date, Stream_time, Stream_duration, Stream_rating) values (234, 58, 99, '2021-04-11', '12:37 PM', 92, 1);
insert into streams (Stream_id, Customer_id, Content_id, Stream_date, Stream_time, Stream_duration, Stream_rating) values (235, 53, 57, '2022-12-19', '10:07 PM', 7, 1);
insert into streams (Stream_id, Customer_id, Content_id, Stream_date, Stream_time, Stream_duration, Stream_rating) values (236, 22, 46, '2022-12-19', '4:44 PM', 17, 4);
insert into streams (Stream_id, Customer_id, Content_id, Stream_date, Stream_time, Stream_duration, Stream_rating) values (237, 2, 64, '2021-07-09', '8:35 PM', 76, 1);
insert into streams (Stream_id, Customer_id, Content_id, Stream_date, Stream_time, Stream_duration, Stream_rating) values (238, 73, 78, '2021-04-02', '7:51 PM', 74, 1);
insert into streams (Stream_id, Customer_id, Content_id, Stream_date, Stream_time, Stream_duration, Stream_rating) values (239, 82, 55, '2021-03-07', '3:47 AM', 77, 4);
insert into streams (Stream_id, Customer_id, Content_id, Stream_date, Stream_time, Stream_duration, Stream_rating) values (240, 90, 58, '2021-03-26', '7:12 AM', 5, 2);
insert into streams (Stream_id, Customer_id, Content_id, Stream_date, Stream_time, Stream_duration, Stream_rating) values (241, 14, 29, '2021-08-19', '11:52 PM', 50, 4);
insert into streams (Stream_id, Customer_id, Content_id, Stream_date, Stream_time, Stream_duration, Stream_rating) values (242, 63, 21, '2021-03-04', '11:30 PM', 38, 3);
insert into streams (Stream_id, Customer_id, Content_id, Stream_date, Stream_time, Stream_duration, Stream_rating) values (243, 88, 52, '2021-04-16', '10:12 AM', 74, 1);
insert into streams (Stream_id, Customer_id, Content_id, Stream_date, Stream_time, Stream_duration, Stream_rating) values (244, 37, 4, '2021-09-12', '11:07 AM', 23, 3);
insert into streams (Stream_id, Customer_id, Content_id, Stream_date, Stream_time, Stream_duration, Stream_rating) values (245, 56, 20, '2021-10-14', '12:42 AM', 77, 5);
insert into streams (Stream_id, Customer_id, Content_id, Stream_date, Stream_time, Stream_duration, Stream_rating) values (246, 71, 74, '2021-01-23', '11:24 AM', 14, 5);
insert into streams (Stream_id, Customer_id, Content_id, Stream_date, Stream_time, Stream_duration, Stream_rating) values (247, 12, 74, '2021-11-29', '1:25 AM', 54, 4);
insert into streams (Stream_id, Customer_id, Content_id, Stream_date, Stream_time, Stream_duration, Stream_rating) values (248, 85, 60, '2021-06-14', '4:08 PM', 31, 2);
insert into streams (Stream_id, Customer_id, Content_id, Stream_date, Stream_time, Stream_duration, Stream_rating) values (249, 24, 50, '2021-04-24', '10:10 AM', 41, 4);
insert into streams (Stream_id, Customer_id, Content_id, Stream_date, Stream_time, Stream_duration, Stream_rating) values (250, 18, 39, '2021-12-18', '12:28 PM', 34, 5);
insert into streams (Stream_id, Customer_id, Content_id, Stream_date, Stream_time, Stream_duration, Stream_rating) values (251, 46, 73, '2022-11-27', '9:04 PM', 8, 3);
insert into streams (Stream_id, Customer_id, Content_id, Stream_date, Stream_time, Stream_duration, Stream_rating) values (252, 36, 78, '2021-01-19', '5:55 PM', 92, 5);
insert into streams (Stream_id, Customer_id, Content_id, Stream_date, Stream_time, Stream_duration, Stream_rating) values (253, 73, 10, '2021-09-06', '1:55 AM', 38, 1);
insert into streams (Stream_id, Customer_id, Content_id, Stream_date, Stream_time, Stream_duration, Stream_rating) values (254, 71, 96, '2021-01-01', '11:20 AM', 49, 4);
insert into streams (Stream_id, Customer_id, Content_id, Stream_date, Stream_time, Stream_duration, Stream_rating) values (255, 61, 60, '2021-05-16', '5:58 PM', 34, 2);
insert into streams (Stream_id, Customer_id, Content_id, Stream_date, Stream_time, Stream_duration, Stream_rating) values (256, 47, 48, '2021-05-10', '11:39 PM', 10, 2);
insert into streams (Stream_id, Customer_id, Content_id, Stream_date, Stream_time, Stream_duration, Stream_rating) values (257, 29, 57, '2022-11-23', '8:34 AM', 44, 5);
insert into streams (Stream_id, Customer_id, Content_id, Stream_date, Stream_time, Stream_duration, Stream_rating) values (258, 46, 69, '2021-02-06', '8:35 PM', 86, 1);
insert into streams (Stream_id, Customer_id, Content_id, Stream_date, Stream_time, Stream_duration, Stream_rating) values (259, 17, 24, '2021-03-29', '2:03 AM', 35, 3);
insert into streams (Stream_id, Customer_id, Content_id, Stream_date, Stream_time, Stream_duration, Stream_rating) values (260, 36, 71, '2021-09-03', '3:49 PM', 41, 2);
insert into streams (Stream_id, Customer_id, Content_id, Stream_date, Stream_time, Stream_duration, Stream_rating) values (261, 52, 28, '2021-03-22', '11:14 PM', 5, 3);
insert into streams (Stream_id, Customer_id, Content_id, Stream_date, Stream_time, Stream_duration, Stream_rating) values (262, 9, 45, '2021-10-17', '12:32 PM', 44, 2);
insert into streams (Stream_id, Customer_id, Content_id, Stream_date, Stream_time, Stream_duration, Stream_rating) values (263, 86, 31, '2021-07-12', '12:22 AM', 60, 4);
insert into streams (Stream_id, Customer_id, Content_id, Stream_date, Stream_time, Stream_duration, Stream_rating) values (264, 7, 99, '2021-01-10', '1:04 AM', 2, 1);
insert into streams (Stream_id, Customer_id, Content_id, Stream_date, Stream_time, Stream_duration, Stream_rating) values (265, 75, 99, '2021-06-23', '1:32 AM', 21, 1);
insert into streams (Stream_id, Customer_id, Content_id, Stream_date, Stream_time, Stream_duration, Stream_rating) values (266, 3, 38, '2022-12-20', '8:12 AM', 12, 4);
insert into streams (Stream_id, Customer_id, Content_id, Stream_date, Stream_time, Stream_duration, Stream_rating) values (267, 61, 34, '2021-01-23', '2:45 PM', 41, 1);
insert into streams (Stream_id, Customer_id, Content_id, Stream_date, Stream_time, Stream_duration, Stream_rating) values (268, 47, 72, '2021-09-16', '2:37 AM', 4, 5);
insert into streams (Stream_id, Customer_id, Content_id, Stream_date, Stream_time, Stream_duration, Stream_rating) values (269, 70, 70, '2021-03-16', '2:50 PM', 56, 5);
insert into streams (Stream_id, Customer_id, Content_id, Stream_date, Stream_time, Stream_duration, Stream_rating) values (270, 62, 89, '2021-06-08', '7:31 AM', 80, 3);
insert into streams (Stream_id, Customer_id, Content_id, Stream_date, Stream_time, Stream_duration, Stream_rating) values (271, 49, 55, '2021-03-18', '2:09 PM', 79, 1);
insert into streams (Stream_id, Customer_id, Content_id, Stream_date, Stream_time, Stream_duration, Stream_rating) values (272, 8, 20, '2021-04-23', '1:33 PM', 59, 1);
insert into streams (Stream_id, Customer_id, Content_id, Stream_date, Stream_time, Stream_duration, Stream_rating) values (273, 55, 13, '2021-06-12', '1:44 PM', 7, 4);
insert into streams (Stream_id, Customer_id, Content_id, Stream_date, Stream_time, Stream_duration, Stream_rating) values (274, 25, 93, '2021-09-30', '3:59 PM', 85, 1);
insert into streams (Stream_id, Customer_id, Content_id, Stream_date, Stream_time, Stream_duration, Stream_rating) values (275, 39, 24, '2021-05-20', '2:52 AM', 19, 2);
insert into streams (Stream_id, Customer_id, Content_id, Stream_date, Stream_time, Stream_duration, Stream_rating) values (276, 92, 8, '2021-04-11', '2:17 PM', 68, 1);
insert into streams (Stream_id, Customer_id, Content_id, Stream_date, Stream_time, Stream_duration, Stream_rating) values (277, 84, 59, '2021-07-17', '2:33 AM', 93, 4);
insert into streams (Stream_id, Customer_id, Content_id, Stream_date, Stream_time, Stream_duration, Stream_rating) values (278, 18, 54, '2021-11-03', '8:33 PM', 61, 4);
insert into streams (Stream_id, Customer_id, Content_id, Stream_date, Stream_time, Stream_duration, Stream_rating) values (279, 50, 85, '2021-11-11', '6:28 AM', 74, 1);
insert into streams (Stream_id, Customer_id, Content_id, Stream_date, Stream_time, Stream_duration, Stream_rating) values (280, 92, 43, '2021-09-05', '7:37 PM', 27, 2);
insert into streams (Stream_id, Customer_id, Content_id, Stream_date, Stream_time, Stream_duration, Stream_rating) values (281, 78, 51, '2021-04-29', '10:54 PM', 5, 2);
insert into streams (Stream_id, Customer_id, Content_id, Stream_date, Stream_time, Stream_duration, Stream_rating) values (282, 45, 84, '2021-02-03', '6:40 PM', 97, 5);
insert into streams (Stream_id, Customer_id, Content_id, Stream_date, Stream_time, Stream_duration, Stream_rating) values (283, 34, 62, '2021-03-02', '3:56 PM', 9, 3);
insert into streams (Stream_id, Customer_id, Content_id, Stream_date, Stream_time, Stream_duration, Stream_rating) values (284, 43, 52, '2021-10-08', '9:15 PM', 52, 2);
insert into streams (Stream_id, Customer_id, Content_id, Stream_date, Stream_time, Stream_duration, Stream_rating) values (285, 23, 53, '2021-05-31', '2:42 PM', 4, 4);
insert into streams (Stream_id, Customer_id, Content_id, Stream_date, Stream_time, Stream_duration, Stream_rating) values (286, 84, 24, '2022-12-23', '6:55 PM', 86, 3);
insert into streams (Stream_id, Customer_id, Content_id, Stream_date, Stream_time, Stream_duration, Stream_rating) values (287, 39, 36, '2022-11-10', '9:15 AM', 44, 3);
insert into streams (Stream_id, Customer_id, Content_id, Stream_date, Stream_time, Stream_duration, Stream_rating) values (288, 15, 60, '2021-04-19', '6:31 AM', 9, 3);
insert into streams (Stream_id, Customer_id, Content_id, Stream_date, Stream_time, Stream_duration, Stream_rating) values (289, 13, 33, '2021-10-04', '3:07 PM', 22, 2);
insert into streams (Stream_id, Customer_id, Content_id, Stream_date, Stream_time, Stream_duration, Stream_rating) values (290, 75, 82, '2021-07-28', '12:51 AM', 11, 3);
insert into streams (Stream_id, Customer_id, Content_id, Stream_date, Stream_time, Stream_duration, Stream_rating) values (291, 64, 5, '2021-06-18', '7:27 PM', 58, 3);
insert into streams (Stream_id, Customer_id, Content_id, Stream_date, Stream_time, Stream_duration, Stream_rating) values (292, 85, 6, '2022-11-14', '9:22 AM', 82, 5);
insert into streams (Stream_id, Customer_id, Content_id, Stream_date, Stream_time, Stream_duration, Stream_rating) values (293, 45, 54, '2021-07-07', '6:34 PM', 36, 2);
insert into streams (Stream_id, Customer_id, Content_id, Stream_date, Stream_time, Stream_duration, Stream_rating) values (294, 71, 8, '2021-05-28', '7:41 AM', 16, 1);
insert into streams (Stream_id, Customer_id, Content_id, Stream_date, Stream_time, Stream_duration, Stream_rating) values (295, 17, 84, '2021-04-02', '11:37 PM', 51, 3);
insert into streams (Stream_id, Customer_id, Content_id, Stream_date, Stream_time, Stream_duration, Stream_rating) values (296, 31, 4, '2021-11-07', '12:06 AM', 86, 4);
insert into streams (Stream_id, Customer_id, Content_id, Stream_date, Stream_time, Stream_duration, Stream_rating) values (297, 77, 35, '2021-04-18', '8:18 AM', 74, 5);
insert into streams (Stream_id, Customer_id, Content_id, Stream_date, Stream_time, Stream_duration, Stream_rating) values (298, 82, 31, '2021-09-08', '9:29 AM', 74, 1);
insert into streams (Stream_id, Customer_id, Content_id, Stream_date, Stream_time, Stream_duration, Stream_rating) values (299, 39, 94, '2021-09-20', '2:01 AM', 78, 5);
insert into streams (Stream_id, Customer_id, Content_id, Stream_date, Stream_time, Stream_duration, Stream_rating) values (300, 55, 62, '2021-04-28', '3:40 AM', 59, 1);
insert into streams (Stream_id, Customer_id, Content_id, Stream_date, Stream_time, Stream_duration, Stream_rating) values (301, 42, 45, '2022-12-17', '1:25 PM', 36, 5);
insert into streams (Stream_id, Customer_id, Content_id, Stream_date, Stream_time, Stream_duration, Stream_rating) values (302, 6, 41, '2021-08-15', '4:25 AM', 15, 4);
insert into streams (Stream_id, Customer_id, Content_id, Stream_date, Stream_time, Stream_duration, Stream_rating) values (303, 61, 96, '2021-01-07', '6:27 PM', 96, 5);
insert into streams (Stream_id, Customer_id, Content_id, Stream_date, Stream_time, Stream_duration, Stream_rating) values (304, 62, 89, '2021-01-29', '12:49 PM', 2, 4);
insert into streams (Stream_id, Customer_id, Content_id, Stream_date, Stream_time, Stream_duration, Stream_rating) values (305, 55, 7, '2021-09-22', '10:52 AM', 88, 5);
insert into streams (Stream_id, Customer_id, Content_id, Stream_date, Stream_time, Stream_duration, Stream_rating) values (306, 50, 43, '2021-03-04', '6:47 AM', 11, 5);
insert into streams (Stream_id, Customer_id, Content_id, Stream_date, Stream_time, Stream_duration, Stream_rating) values (307, 74, 66, '2021-10-28', '3:52 AM', 85, 3);
insert into streams (Stream_id, Customer_id, Content_id, Stream_date, Stream_time, Stream_duration, Stream_rating) values (308, 47, 19, '2021-07-25', '1:03 AM', 12, 4);
insert into streams (Stream_id, Customer_id, Content_id, Stream_date, Stream_time, Stream_duration, Stream_rating) values (309, 72, 94, '2021-05-22', '4:58 PM', 62, 3);
insert into streams (Stream_id, Customer_id, Content_id, Stream_date, Stream_time, Stream_duration, Stream_rating) values (310, 13, 51, '2021-04-09', '1:15 PM', 84, 3);
insert into streams (Stream_id, Customer_id, Content_id, Stream_date, Stream_time, Stream_duration, Stream_rating) values (311, 1, 61, '2021-06-20', '9:41 AM', 88, 1);
insert into streams (Stream_id, Customer_id, Content_id, Stream_date, Stream_time, Stream_duration, Stream_rating) values (312, 7, 95, '2021-01-27', '4:34 AM', 37, 5);
insert into streams (Stream_id, Customer_id, Content_id, Stream_date, Stream_time, Stream_duration, Stream_rating) values (313, 96, 30, '2021-01-03', '1:46 AM', 59, 1);
insert into streams (Stream_id, Customer_id, Content_id, Stream_date, Stream_time, Stream_duration, Stream_rating) values (314, 63, 18, '2021-10-08', '2:38 AM', 92, 5);
insert into streams (Stream_id, Customer_id, Content_id, Stream_date, Stream_time, Stream_duration, Stream_rating) values (315, 36, 96, '2021-07-30', '3:54 AM', 64, 5);
insert into streams (Stream_id, Customer_id, Content_id, Stream_date, Stream_time, Stream_duration, Stream_rating) values (316, 70, 4, '2021-10-08', '8:50 PM', 2, 3);
insert into streams (Stream_id, Customer_id, Content_id, Stream_date, Stream_time, Stream_duration, Stream_rating) values (317, 90, 96, '2021-02-27', '3:48 AM', 4, 5);
insert into streams (Stream_id, Customer_id, Content_id, Stream_date, Stream_time, Stream_duration, Stream_rating) values (318, 60, 90, '2022-12-03', '9:49 PM', 26, 3);
insert into streams (Stream_id, Customer_id, Content_id, Stream_date, Stream_time, Stream_duration, Stream_rating) values (319, 65, 55, '2021-10-23', '7:35 PM', 16, 3);
insert into streams (Stream_id, Customer_id, Content_id, Stream_date, Stream_time, Stream_duration, Stream_rating) values (320, 73, 23, '2021-01-25', '5:34 AM', 100, 4);
insert into streams (Stream_id, Customer_id, Content_id, Stream_date, Stream_time, Stream_duration, Stream_rating) values (321, 28, 91, '2021-06-29', '4:35 AM', 37, 4);
insert into streams (Stream_id, Customer_id, Content_id, Stream_date, Stream_time, Stream_duration, Stream_rating) values (322, 64, 35, '2021-10-03', '2:24 AM', 73, 4);
insert into streams (Stream_id, Customer_id, Content_id, Stream_date, Stream_time, Stream_duration, Stream_rating) values (323, 32, 38, '2021-03-27', '6:24 AM', 35, 2);
insert into streams (Stream_id, Customer_id, Content_id, Stream_date, Stream_time, Stream_duration, Stream_rating) values (324, 41, 19, '2021-05-18', '7:35 PM', 34, 5);
insert into streams (Stream_id, Customer_id, Content_id, Stream_date, Stream_time, Stream_duration, Stream_rating) values (325, 91, 87, '2021-08-20', '7:58 AM', 50, 2);
insert into streams (Stream_id, Customer_id, Content_id, Stream_date, Stream_time, Stream_duration, Stream_rating) values (326, 6, 30, '2021-09-29', '12:13 PM', 13, 3);
insert into streams (Stream_id, Customer_id, Content_id, Stream_date, Stream_time, Stream_duration, Stream_rating) values (327, 20, 40, '2021-10-01', '1:10 AM', 60, 4);
insert into streams (Stream_id, Customer_id, Content_id, Stream_date, Stream_time, Stream_duration, Stream_rating) values (328, 73, 91, '2022-12-01', '3:06 PM', 38, 1);
insert into streams (Stream_id, Customer_id, Content_id, Stream_date, Stream_time, Stream_duration, Stream_rating) values (329, 76, 56, '2021-01-01', '2:16 PM', 18, 2);
insert into streams (Stream_id, Customer_id, Content_id, Stream_date, Stream_time, Stream_duration, Stream_rating) values (330, 71, 14, '2022-12-27', '3:43 AM', 95, 3);
insert into streams (Stream_id, Customer_id, Content_id, Stream_date, Stream_time, Stream_duration, Stream_rating) values (331, 33, 80, '2021-08-19', '11:45 PM', 65, 3);
insert into streams (Stream_id, Customer_id, Content_id, Stream_date, Stream_time, Stream_duration, Stream_rating) values (332, 69, 2, '2021-05-09', '9:39 AM', 10, 3);
insert into streams (Stream_id, Customer_id, Content_id, Stream_date, Stream_time, Stream_duration, Stream_rating) values (333, 71, 56, '2021-04-29', '9:45 PM', 68, 4);
insert into streams (Stream_id, Customer_id, Content_id, Stream_date, Stream_time, Stream_duration, Stream_rating) values (334, 38, 60, '2021-01-08', '10:00 PM', 14, 5);
insert into streams (Stream_id, Customer_id, Content_id, Stream_date, Stream_time, Stream_duration, Stream_rating) values (335, 43, 18, '2021-03-24', '11:16 PM', 15, 2);
insert into streams (Stream_id, Customer_id, Content_id, Stream_date, Stream_time, Stream_duration, Stream_rating) values (336, 71, 86, '2021-03-15', '3:48 AM', 96, 5);
insert into streams (Stream_id, Customer_id, Content_id, Stream_date, Stream_time, Stream_duration, Stream_rating) values (337, 66, 34, '2022-12-05', '3:22 PM', 76, 1);
insert into streams (Stream_id, Customer_id, Content_id, Stream_date, Stream_time, Stream_duration, Stream_rating) values (338, 20, 86, '2021-03-15', '11:43 PM', 100, 3);
insert into streams (Stream_id, Customer_id, Content_id, Stream_date, Stream_time, Stream_duration, Stream_rating) values (339, 52, 55, '2021-11-05', '11:57 AM', 79, 5);
insert into streams (Stream_id, Customer_id, Content_id, Stream_date, Stream_time, Stream_duration, Stream_rating) values (340, 8, 91, '2021-02-27', '4:19 PM', 77, 1);
